,id,url,image,title,platform,release_date,summary,metascore,userscore,genre
845,555798,https://www.metacritic.com/game/pc/corruption-2029,https://static.metacritic.com/images/products/games/8/bd15ee3387f4ff1bcbb56e679c316cc1-98.jpg,Corruption 2029,PC,"February 17, 2020","Set in a dystopian America in the not-so distant future. CORRUPTION 2029 is a new tactical strategy game from The Bearded Ladies, creators of â€˜Mutant Year Zero: Road to Edenâ€™. Using your supreme tactical abilities, command a squad of heavily augmented â€˜unitsâ€™ deep into enemy territory to discover the cause of the CORRUPTION. CORRUPTION 2029 is a hardcore tactical game that should test the mettle of even the most experienced tactical gamers. [Epic]",64,6.0,Turn-Based
846,555001,https://www.metacritic.com/game/pc/mission-its-complicated,https://static.metacritic.com/images/products/games/1/bab653c9f0929a4ecb736b4954489c78-98.jpg,Mission: It's Complicated,PC,"February 14, 2020","Mission: Itâ€™s Complicated is a narrative-based, visual novel where you match super-awesome superheroes to go on missions during the night and dates during the day. The more compatible the pair of superheroes are, the more likely that they will fall in love and save the world.",91,7.0,Turn-Based
847,555414,https://www.metacritic.com/game/xbox-one/spaceland,https://static.metacritic.com/images/products/games/4/30684f57cdd782706891715472cfef89-98.jpg,Spaceland,Xbox One,"February 14, 2020","An turn-based strategy that revives the traditions of old-school sci-fi tactics. Less covers, more action! Land on a lost planet and show the mutants what you are made of. Shoot, kick, blow up and destroy. Assemble the most reckless team of fighters and unravel the mysteries of the mystical planet.",78,tbd,Turn-Based
848,554713,https://www.metacritic.com/game/switch/fire-emblem-three-houses---side-story-cindered-shadows,https://static.metacritic.com/images/products/games/3/760cb2e13ad8a6f4fbbe59206b16ee38-98.jpg,Fire Emblem: Three Houses - Side Story: Cindered Shadows,Switch,"February 13, 2020","Work with a group called the Ashen Wolves, a forgotten group of students who inhabit the underground facility called Abyss. Yuri, Hapi, Balthus, and Constance are the four members of the Ashen Wolves.",75,8.2,Turn-Based
849,543918,https://www.metacritic.com/game/switch/the-dark-crystal-age-of-resistance-tactics,https://static.metacritic.com/images/products/games/8/52e4c8cda0fafcfb69b76938fab27d48-98.jpg,The Dark Crystal: Age of Resistance Tactics,Switch,"February 4, 2020","Netflix's The Dark Crystal: Age of Resistance comes to life as a thrilling tactical strategy game!

In The Dark Crystal: Age of Resistance Tactics, lead the heroic Gelfling to restore light to the world of Thra! Experience everything the fantasy world has to offer by playing throughand going beyondthe events of the Netflix series. Encounter never-seen-before playable characters, stories, and environments. 

Over the course of 80 unique turn-based campaign battles taking place across the lands of Thra, recruit new allies and customize their forces by assigning them jobs and outfitting them with new equipment.

Continue the Story in an Expanded World of Thra - Delve deeper into the legend of The Dark Crystal to learn more about the Gelfling clans and their histories across more than 5 diverse, modular territories. Choose from over 15 character jobs, play through reimagined and brand-new battles against the malicious Skeksis and help lead the proud Gelfling to victory.

Gelfling Tactics - Devise unique ways for the outmatched Gelfling to fulfill their prophecy in multi-layered, turn-based tactical combat. Units can be customized for specific fights with gear, upgradable abilities and a job system. Use guile, planning and cunning to overcome superior foes!

Highly Replayable - Replay finished battles to earn full marks or replay the entire game! Once completed, challenge New Game+ mode, keeping all progress from the first playthrough while facing more difficult versions of battles.

Rich, Dynamic Environments - The world of Thra is a living, unpredictable environment as dangerous as it is beautiful. Dynamic events on the battlefield may create opportunities or put the Gelflings at a disadvantage, necessitating rapid changes in strategy.",59,6.9,Turn-Based
850,543966,https://www.metacritic.com/game/playstation-4/the-dark-crystal-age-of-resistance-tactics,https://static.metacritic.com/images/products/games/6/bf46d78e9fee7fb85979bfe1705d454c-98.jpg,The Dark Crystal: Age of Resistance Tactics,PlayStation 4,"February 4, 2020","Netflix's The Dark Crystal: Age of Resistance comes to life as a tactical strategy game. In The Dark Crystal: Age of Resistance Tactics, lead the heroic Gelfling to restore light to the world of Thra! Experience everything the fantasy world has to offer by playing throughand going beyondthe events of the Netflix series. Encounter never-seen-before playable characters, stories, and environments.  Over the course of 80 unique turn-based campaign battles taking place across the lands of Thra, recruit new allies and customize their forces by assigning them jobs and outfitting them with new equipment. Continue the Story in an Expanded World of Thra - Delve deeper into the legend of The Dark Crystal to learn more about the Gelfling clans and their histories across more than 5 diverse, modular territories. Choose from over 15 character jobs, play through reimagined and brand-new battles against the malicious Skeksis and help lead the proud Gelfling to victory.

Gelfling Tactics - Devise unique ways for the outmatched Gelfling to fulfill their prophecy in multi-layered, turn-based tactical combat. Units can be customized for specific fights with gear, upgradable abilities and a job system. Use guile, planning and cunning to overcome superior foes!

Highly Replayable - Replay finished battles to earn full marks or replay the entire game! Once completed, challenge New Game+ mode, keeping all progress from the first playthrough while facing more difficult versions of battles.

Rich, Dynamic Environments - The world of Thra is a living, unpredictable environment as dangerous as it is beautiful. Dynamic events on the battlefield may create opportunities or put the Gelflings at a disadvantage, necessitating rapid changes in strategy.",59,4.6,Turn-Based
851,543971,https://www.metacritic.com/game/xbox-one/the-dark-crystal-age-of-resistance-tactics,https://static.metacritic.com/images/products/games/1/8622d148693a1d5b3c1c62e275235786-98.jpg,The Dark Crystal: Age of Resistance Tactics,Xbox One,"February 4, 2020","Netflix's The Dark Crystal: Age of Resistance comes to life as a tactical strategy game. In The Dark Crystal: Age of Resistance Tactics, lead the heroic Gelfling to restore light to the world of Thra! Experience everything the fantasy world has to offer by playing throughand going beyondthe events of the Netflix series. Encounter never-seen-before playable characters, stories, and environments.  Over the course of 80 unique turn-based campaign battles taking place across the lands of Thra, recruit new allies and customize their forces by assigning them jobs and outfitting them with new equipment. Continue the Story in an Expanded World of Thra - Delve deeper into the legend of The Dark Crystal to learn more about the Gelfling clans and their histories across more than 5 diverse, modular territories. Choose from over 15 character jobs, play through reimagined and brand-new battles against the malicious Skeksis and help lead the proud Gelfling to victory.

Gelfling Tactics - Devise unique ways for the outmatched Gelfling to fulfill their prophecy in multi-layered, turn-based tactical combat. Units can be customized for specific fights with gear, upgradable abilities and a job system. Use guile, planning and cunning to overcome superior foes!

Highly Replayable - Replay finished battles to earn full marks or replay the entire game! Once completed, challenge New Game+ mode, keeping all progress from the first playthrough while facing more difficult versions of battles.

Rich, Dynamic Environments - The world of Thra is a living, unpredictable environment as dangerous as it is beautiful. Dynamic events on the battlefield may create opportunities or put the Gelflings at a disadvantage, necessitating rapid changes in strategy.",58,4.5,Turn-Based
852,543972,https://www.metacritic.com/game/pc/the-dark-crystal-age-of-resistance-tactics,https://static.metacritic.com/images/products/games/2/fc15bc9d734d2d86d20b3e4dbc06b88c-98.jpg,The Dark Crystal: Age of Resistance Tactics,PC,"February 4, 2020","Netflix's The Dark Crystal: Age of Resistance comes to life as a thrilling tactical strategy game!

In The Dark Crystal: Age of Resistance Tactics, lead the heroic Gelfling to restore light to the world of Thra! Experience everything the fantasy world has to offer by playing throughand going beyondthe events of the Netflix series. Encounter never-seen-before playable characters, stories, and environments. 

Over the course of 80 unique turn-based campaign battles taking place across the lands of Thra, recruit new allies and customize their forces by assigning them jobs and outfitting them with new equipment.

Continue the Story in an Expanded World of Thra - Delve deeper into the legend of The Dark Crystal to learn more about the Gelfling clans and their histories across more than 5 diverse, modular territories. Choose from over 15 character jobs, play through reimagined and brand-new battles against the malicious Skeksis and help lead the proud Gelfling to victory.

Gelfling Tactics - Devise unique ways for the outmatched Gelfling to fulfill their prophecy in multi-layered, turn-based tactical combat. Units can be customized for specific fights with gear, upgradable abilities and a job system. Use guile, planning and cunning to overcome superior foes!

Highly Replayable - Replay finished battles to earn full marks or replay the entire game! Once completed, challenge New Game+ mode, keeping all progress from the first playthrough while facing more difficult versions of battles.

Rich, Dynamic Environments - The world of Thra is a living, unpredictable environment as dangerous as it is beautiful. Dynamic events on the battlefield may create opportunities or put the Gelflings at a disadvantage, necessitating rapid changes in strategy.",67,6.6,Turn-Based
853,522661,https://www.metacritic.com/game/playstation-4/ash-of-gods-redemption,https://static.metacritic.com/images/products/games/1/bd812ebd2d9b648b3d8598f11485b93f-98.jpg,Ash of Gods: Redemption,PlayStation 4,"January 31, 2020","Ash of Gods is a tactical turn-based RPG with rich lore and detailed nonlinear storyline about three heroes facing an ancient mythical evil. Captain Thorn Brenin, the guard Lo Pheng and scribe Hopper Rouley donâ€™t yet know that the Reapers have returned and are planning to drown the world in blood so they can awaken the slumbering gods.

The story can change at any time depending on your choices, sometimes leading to a characterâ€™s death. This wonâ€™t end the game, however, as the narrative continues without the hero but takes into account the consequences of his demise on future events. Donâ€™t rely on a single tactic or a powerful team to win the game â€“ the AI in Ash of Gods adapts to your gaming style and forces you to be more cunning!",65,6.9,Turn-Based
854,555213,https://www.metacritic.com/game/pc/might-magic-chess-royale,https://static.metacritic.com/images/products/games/3/27bed00be9933f136fd7660e6a4a0dc6-98.jpg,Might & Magic: Chess Royale,PC,"January 30, 2020","Discover the first massive real-time 100 players autobattler. 
Fight 99 other players on a real-time chess battlefield and be the last hero standing! Re-discover classic units and heroes from the Might & Magic high-fantasy universe and create deep strategies in ten-minute competition. Who will win the Chess Royale?",65,3.3,Turn-Based
855,551759,https://www.metacritic.com/game/ios/magic-manastrike,https://static.metacritic.com/images/products/games/9/b67ddc51f485bd8e66f4b6adef6097ac-98.jpg,Magic: ManaStrike,iOS,"January 29, 2020",Magic: ManaStrike is a real-time PvP game using Magic: The Gathering's vast lore and collection of cards. Experience dynamic battles with MTG cards re-envisioned through high quality 3D. Build unique decks for different strategies. Create or join teams to meet new friends and enhance your reputation.,78,tbd,Turn-Based
856,555210,https://www.metacritic.com/game/switch/thronebreaker-the-witcher-tales,https://static.metacritic.com/images/products/games/0/b3950d40a50edd2a639879ad334139f3-98.jpg,Thronebreaker: The Witcher Tales,Switch,"January 28, 2020","Thronebreaker is a single player role-playing game set in the world of The Witcher that combines narrative-driven exploration with unique puzzles and card battle mechanics.

Crafted by the developers responsible for some of the most iconic moments in The Witcher 3: Wild Hunt, the game spins a truly regal tale of Meve, a war-veteran and queen of two Northern Realms Lyria and Rivia. Facing an imminent Nilfgaardian invasion, Meve is forced to once again enter the warpath and set out on a dark journey of destruction and revenge.

KEY FEATURES

AN ALL NEW EPIC TALE
* Experience an all-new 30-hour Witcher world tale with 20 possible world end-states.
* Embark on a grand adventure full of thought-provoking quests.
* Influence the state of the world around you by making difficult choices and face their consequences.
* Meet a cast of rich, multidimensional characters some of them will join you on your quest, others you'll have to face on the battlefield.

TRAVEL TO NEVER-BEFORE-SEEN KINGDOMS
* Explore new and mysterious regions of the monster-infested world of The Witcher.
* Traverse vast lands and unique locations, all with their distinct theme from vibrant countrysides and war-torn landscapes, to grand castles and snow-capped mountains.
* Save villages from hordes of monsters, look for treasures hidden among ancient ruins, scour the land for resources, and more the world of Thronebreaker is teeming with things to do.

PREPARE FOR WAR
* Develop and customize your very own battle camp.
* Train and recruit units, unlock new skills and work on your tactics.
* Manage resources you find and trade them with local merchants.
* Learn more about your companions and increase their strength in battle.

LEAD YOUR ARMY IN EPIC BATTLES
* Build an army from characters you meet and interact with during your journey.
* Fight in epic story battles and solve unique puzzles and challenges.
* Use unique skills and abilities of your army and lead it to victory.",84,7.3,Turn-Based
857,553050,https://www.metacritic.com/game/switch/warhammer-40000-space-wolf,https://static.metacritic.com/images/products/games/0/94aaa1a1bd6d40830703a53f95be5b8d-98.jpg,"Warhammer 40,000: Space Wolf",Switch,"January 23, 2020","Take command of a Space Wolves squad led by Valgard Twice Slain. Your Great Company's Strike Cruiser fell into a trap set by Chaos Space Marines of the Word Bearers legion causing you to make a forced landing on Kanak, a volcano-wracked feral world, inhabited by tribes of ruthless barbarians. Not only must you survive, but you must emerge victorious.

Game features:

Defeat the unrelenting enemies of the Space Wolves:
* An epic campaign with branching storylines, spanning hostile environments on a distant planet.
* Combat the Word Bearers - fanatical and deadly traitors who serve the chaos gods.

Brutal Tactical Combat:
* Lead your Space Wolves into fierce battles in glorious, diverse environments;
* Challenge your Brothers in multiplayer and earn ultimate rewards by proving your leadership.

Choose Your Path:
* Grey Hunter, Wolf Scout or Wolf Guard You decide which path to follow, to best match your own style, strategy and tactics.",55,6.9,Turn-Based
858,520490,https://www.metacritic.com/game/pc/phoenix-point,https://static.metacritic.com/images/products/games/0/7a3a7ffe1f677ea3196a89197f24a708-98.jpg,Phoenix Point,PC,"December 3, 2019","2022 â€“ The Pandoravirus Unleashed. An unusual virus discovered in melting permafrost excites the scientific community. It has a massive genome, and only 1% of its genes match anything in existing databases. â€œWhat the hell is going on with the other genes?â€ asks researcher Jean-Michel Moreau. â€œThis opens a Pandoraâ€™s box. What kinds of discoveries are going to come from studying the contents?â€ The seas transform in something totally alien. Then the mutagens began to invade the land via an airborne microbial mist.",74,5.8,Turn-Based
859,537264,https://www.metacritic.com/game/pc/sd-gundam-g-generation-cross-rays,https://static.metacritic.com/images/products/games/4/b27fc6afa3a6b52281960bb874dd00d9-98.jpg,SD Gundam G Generation Cross Rays,PC,"November 27, 2019","Beyond creation, four eras come together as one!
Discover the latest entry in this iconic Tactical RPG series.
Form your own team of SD Gundams and deploy for battle -- with units from from Mobile Suit Gundam Wing, SEED, 00, and Iron-Blooded Orphans!

Intense battle scenes rendered with high-def 3D models and dynamic animations with character cut-ins.
Featuring game design unique to the series with Development, Design, and Capture, as well as+ various other strategic elements. Form your own team and deploy for battle!",71,7.7,Turn-Based
860,549756,https://www.metacritic.com/game/playstation-4/sid-meiers-civilization-vi,https://static.metacritic.com/images/products/games/6/77690f29c2bebd383547c672f32c5560-98.jpg,Sid Meier's Civilization VI,PlayStation 4,"November 22, 2019","Civilization VI offers new ways to interact with your world, expand your empire across the map, advance your culture, and compete against historys greatest leaders to build a civilization that will stand the test of time.",87,6.7,Turn-Based
861,549757,https://www.metacritic.com/game/xbox-one/sid-meiers-civilization-vi,https://static.metacritic.com/images/products/games/7/92ea4614d1fa4091a00e13295eb8b983-98.jpg,Sid Meier's Civilization VI,Xbox One,"November 22, 2019","Civilization VI offers new ways to interact with your world, expand your empire across the map, advance your culture, and compete against historys greatest leaders to build a civilization that will stand the test of time.",86,6.5,Turn-Based
862,523171,https://www.metacritic.com/game/xbox-one/narcos-rise-of-the-cartels,https://static.metacritic.com/images/products/games/1/4db5d54a5571c5b4e1ccd55822cf6237-98.jpg,Narcos: Rise of the Cartels,Xbox One,"November 22, 2019","Welcome to Colombia, 1980's -- the fires of El Patron's empire have been lit, its influence spanning borders, and expansion unabated. Influence and corruption is rife; cops, guards, politicians and those in between are falling into the pocket of the MedellÃ­n Cartel, and after years of production, America is finally taking notice.

Narcos: Rise of the Cartels tells the story of the hit Netflix TV series, of the rise and fall of El Patron. Choose your side and ally with the DEA or conversely side with the Narcos. Explore recognisable locations from the show and take a role in pivotal world-altering events and battles that will define and shift the war on drugs.

Form your team from a variety of class-specific roles, join leading characters, upgrade your skills and take part in brutal turn-based combat, where your actions will have consequence. Plata o Plomo?",63,2.6,Turn-Based
863,550752,https://www.metacritic.com/game/pc/battletech-heavy-metal,https://static.metacritic.com/images/products/games/2/f2fafc02379f2d82d65de2065772dcc5-98.jpg,BattleTech: Heavy Metal,PC,"November 21, 2019","Eight new â€˜Mechs have been added to the world of BATTLETECH, including seven classic designs from the original board game along with a never-before-seen â€˜Mech designed exclusively for this expansion. New methods of destruction await as eight devastating weapons systems are now available to wreak havoc like never before. Heavy Metal takes â€˜Mech action to the next level with a brand new Flashpoint Mini-Campaign featuring two legendary characters from the famous mercenary group, Wolfâ€™s Dragoons, and a mysterious derelict cargo ship.",73,tbd,Turn-Based
864,550749,https://www.metacritic.com/game/pc/age-of-wonders-planetfall---revelations,https://static.metacritic.com/images/products/games/9/7c9206cc9fc80a73541615a37edd012e-98.jpg,Age of Wonders: Planetfall - Revelations,PC,"November 19, 2019","Revelations introduces the ancient Heritor Secret Technology, new campaign missions, location mechanics and more. Revelations is the first expansion from Triumph Studios for Age of Wonders: Planetfall, the turn-based strategy game with in-depth empire building.",78,tbd,Turn-Based
865,523169,https://www.metacritic.com/game/pc/narcos-rise-of-the-cartels,https://static.metacritic.com/images/products/games/9/0ba97e63010f3e6d93c3c5346568de00-98.jpg,Narcos: Rise of the Cartels,PC,"November 19, 2019","Welcome to Colombia, 1980's -- the fires of El Patron's empire have been lit, its influence spanning borders, and expansion unabated. Influence and corruption is rife; cops, guards, politicians and those in between are falling into the pocket of the MedellÃ­n Cartel, and after years of production, America is finally taking notice.

Narcos: Rise of the Cartels tells the story of the hit Netflix TV series, of the rise and fall of El Patron. Choose your side and ally with the DEA or conversely side with the Narcos. Explore recognisable locations from the show and take a role in pivotal world-altering events and battles that will define and shift the war on drugs.

Form your team from a variety of class-specific roles, join leading characters, upgrade your skills and take part in brutal turn-based combat, where your actions will have consequence. Plata o Plomo?",45,2.6,Turn-Based
866,523170,https://www.metacritic.com/game/playstation-4/narcos-rise-of-the-cartels,https://static.metacritic.com/images/products/games/0/90348c7a104592cadea26d503ae7063f-98.jpg,Narcos: Rise of the Cartels,PlayStation 4,"November 19, 2019","Welcome to Colombia, 1980's -- the fires of El Patron's empire have been lit, its influence spanning borders, and expansion unabated. Influence and corruption is rife; cops, guards, politicians and those in between are falling into the pocket of the MedellÃ­n Cartel, and after years of production, America is finally taking notice.

Narcos: Rise of the Cartels tells the story of the hit Netflix TV series, of the rise and fall of El Patron. Choose your side and ally with the DEA or conversely side with the Narcos. Explore recognisable locations from the show and take a role in pivotal world-altering events and battles that will define and shift the war on drugs.

Form your team from a variety of class-specific roles, join leading characters, upgrade your skills and take part in brutal turn-based combat, where your actions will have consequence. Plata o Plomo?",59,3.0,Turn-Based
867,539155,https://www.metacritic.com/game/pc/unity-of-command-ii,https://static.metacritic.com/images/products/games/5/54a7d28b8aa6a8edb00773920d790519-98.jpg,Unity of Command II,PC,"November 12, 2019",Unity of Command II is the sequel to one of the most critically acclaimed strategy games of all time; a game critics called 'the perfect gateway' into computer war games.,88,7.6,Turn-Based
868,532025,https://www.metacritic.com/game/switch/the-lord-of-the-rings-adventure-card-game,https://static.metacritic.com/images/products/games/5/34af1db9df9ed7efdc34147d44e84b7b-98.jpg,The Lord of the Rings: Adventure Card Game,Switch,"November 5, 2019","Build a deck of iconic Heroes and challenge the forces of Sauron in this thrilling tactical card game. Go forth and explore famous locations, complete story-driven quests, and forge your own legend of Middle-earth. But beware the Eye of Sauronâ€”should you draw his attention, all will be lostâ€¦

Answer the call of countless adventures, face the dark forces of Sauron, and protect the Free Peoples of Middle-earth. As allies gather and foes arise, so your journey begins.",75,7.5,Turn-Based
869,543891,https://www.metacritic.com/game/switch/disgaea-4-complete+,https://static.metacritic.com/images/products/games/1/972c463146165859413036e4fdfe7cd5-98.jpg,Disgaea 4 Complete+,Switch,"October 29, 2019","When the Corrupternment threatens to disrupt the way of life in Hades, Valvatorez finds himself at the helm of a fiery revolution. Dive into a tale of revolution and redemption, woven throughout a dark and hilarious realm of vampires, werewolves, and other devilish denizens. Engage in immersive and in-depth tactics-based gameplay brimming with over-the-top destructive action, and unload a horde of special features to take your Netherworldly adventures to another level.",85,7.2,Turn-Based
870,543892,https://www.metacritic.com/game/playstation-4/disgaea-4-complete+,https://static.metacritic.com/images/products/games/2/7b4532ce5ce1831102db52f9c755d5e1-98.jpg,Disgaea 4 Complete+,PlayStation 4,"October 29, 2019","When the ruling powers of Hades are revealed to be corrupt, Valvatorez must spark a rebellion to bring them down! Armed to the teeth with dynamic, over-the-top gameplay and a horde of special features, this is the ultimate Disgaea.",83,5.9,Turn-Based
