,id,url,image,title,platform,release_date,summary,metascore,userscore,genre
69,109692,https://www.metacritic.com/game/playstation-3/hail-to-the-chimp,https://static.metacritic.com/images/products/games/2/97a776644bc3539af1a543e33d08c1fa-98.jpg,Hail to the Chimp,PlayStation 3,"June 30, 2008","Since the dawn of time, Man has wondered who would win if a polar bear and jellyfish teamed up to fight an armadillo and yak. Do you have what it takes (approximately $40) to learn the shocking truth? When the King of the Animals is forced to resign in disgrace, a motley group of candidates turns out for a bare-knuckle campaign to win the Crown. From Ptolemy, the mighty hippo, to Crackers, the devious monkey, each of the ten candidates has distinct strengths and strategies, but the same hunger for political power. Hail to the Chimp is a party game that delivers exciting gameplay, lush interactive environments, and a comic look at politics. Players use the game’s unique team-up mechanic, mixing cooperation with competition, to claw their way to victory. Whether played by four friends on one TV, online against distant challengers or single-player against advanced AI, Hail to the Chimp offers endlessly replayable party fun for gamers of all stripes. [Gamecock Media]",51,4.2,Party
70,111992,https://www.metacritic.com/game/ds/lol-never-party-alone!,https://static.metacritic.com/images/products/games/2/67c5aca4ab920716ff94c3538b5dbf36-98.jpg,LOL: Never Party Alone!,DS,"May 30, 2008","(Also known as ""Bakushow"" in the UK/EU)  A unique, free-form gaming experience, LOL’s motto says it best: “If the game is boring, then you are boring.” LOL is played by one of the players making a challenge in writing to the others. The crazier the challenge, the more fun everyone will have. The person who delivered the challenge chooses an appropriate time limit, and everyone has to answer the challenge on their touch screen however they see fit – with words, pictures, or whatever comes to mind. The host reveals the answers, and everyone votes on a winner who will then decide on the challenge for the next round. Always different and a blast to play every time, LOL will, as its name implies, make everyone laugh out loud. [Agetec]",56,2.3,Party
71,111993,https://www.metacritic.com/game/xbox-360/rocky-and-bullwinkle,https://static.metacritic.com/images/products/games/3/5affde3fb69e7539ad8bc309eb2ffc49-98.jpg,Rocky and Bullwinkle,Xbox 360,"April 16, 2008","[Xbox Live Arcade]  Rocky & Bullwinkle offers a fast, fun collection of over 100 micro-games, starring your favorite characters from the classic cartoon series: Rocky and Bullwinkle, Boris and Natasha, Dudley Do-Right, and many more. Xbox LIVE Vision owners can control 25 of the games using gestures. The fast action and quick games create an easy pick-up-and-play experience for gamers of all ages. Hotseat multiplayer: Up to twelve players can compete locally in hotseat mode. [ZEN Studios]",37,4.4,Party
72,108351,https://www.metacritic.com/game/wii/bomberman-land,https://static.metacritic.com/images/products/games/1/dd272def4f873e8dab4a251140d72988-98.jpg,Bomberman Land,Wii,"January 29, 2008","Bomberman Land brings together 3 exciting game modes into one. The series introduces a bevy of mini-games, where most can be played in multiplayer mode.  The PSP system version features 50 mini-games, the Wii features 50, and the DS has 40 unique mini-games. In addition, the Bomberman Land series features a robust single-player Story Mode, where players can explore a fantasy land and solve quests and puzzles with the ultimate goal of restoring peace and tranquility to the beleaguered Bomberman world. Best of all, the game includes the Battle Pack Mode, the classic multiplayer Bomberman experience that gamers know and love. The PSP system and the DS versions both allow gamers to share one game cartridge and network with friends to create the ultimate party game. [Hudson Soft]",57,7.8,Party
73,109482,https://www.metacritic.com/game/psp/bomberman-land-portable,https://static.metacritic.com/images/products/games/2/2900385a28b63d36320141650dbe7460-98.jpg,Bomberman Land Portable,PSP,"January 29, 2008","Bomberman Land brings together 3 exciting game modes into one. The series introduces a bevy of mini-games, where most can be played in multiplayer mode. The PSP system version features 50 mini-games, the Wii features 50, and the DS has 40 unique mini-games. In addition, the Bomberman Land series features a robust single-player Story Mode, where players can explore a fantasy land and solve quests and puzzles with the ultimate goal of restoring peace and tranquility to the beleaguered Bomberman world. Best of all, the game includes the Battle Pack Mode, the classic multiplayer Bomberman experience that gamers know and love. The PSP system and the DS versions both allow gamers to share one game cartridge and network with friends to create the ultimate party game. [Hudson Soft]",55,7.8,Party
74,109040,https://www.metacritic.com/game/wii/furu-furu-park,https://static.metacritic.com/images/products/games/0/ebe969444831fd647376d2f7d63058c1-98.jpg,Furu Furu Park,Wii,"January 17, 2008","Furu Furu Park is a collection of 30 arcade-style games that take advantage of the Wii Remote’s range of motion to engage and entertain players of all skill levels and ages. Arkanoid: an arcade classic pitting paddle and ball against a wall of blocks; Pinch Hitter: step up to the plate and take a few swings with the Wii Remote; Bubble Bobble: hold the Wii Remote like an NES controller to burst all of the bubbles in this retro arcade puzzler; Safe Cracker: Memorize the combination then enter the code by tilting your Wii Remote left and right to crack the safe; Sonic Blastman 20XX: Clutch your Wii Remote and punch at the screen to destroy asteroids heading for earth; Super Karate: Execute offensive and defensive maneuvers with your Wii Remote to defeat your opponent. Players can also face off against a friend in three multiplayer modes: Free Battle, Panel Attack and Love Challenge where players will have to compete to win female affection. [Majesco]",43,4.8,Party
75,110480,https://www.metacritic.com/game/wii/game-party,https://static.metacritic.com/images/products/games/0/a4a303d2148cc4db4d9730a7c6fc4387-98.jpg,Game Party,Wii,"November 27, 2007","Game Party for the Wii is a collection of classic skill games from around the world, from American sports venues to European gathering spots. Using the Wii’s unique control interface, you can play classics such as darts; modern favorites such as table hockey and hoop shoot, or participate in multiplayer trivia contests. More than a half dozen games are available. [Midway]",25,3.9,Party
76,110609,https://www.metacritic.com/game/ds/mario-party-ds,https://static.metacritic.com/images/products/games/9/375023307eb38f13eaf38d966f0d8ebe-98.jpg,Mario Party DS,DS,"November 19, 2007","You'd think years of defeat would get to a guy, but Bowser just doesn't give up! He's captured Mario and his friends in his pursuit of a crystal that the group collected when it fell from the sky, and he doesn't hesitate to shrink them to miniature size to get rid of them and get his hands on the other four crystals. The mini-heroes have to find the crystals before he does, making their way through giant environments filled with enormous creatures. The single-player campaign takes place in five different settings, each of them ending with a boss. As usual, players have to collect coins and stars, at the same time escaping dangers such as Piranha Plants and other classic creatures from the Mario universe. As they progress through the game, players also can unlock various mini-games, such as Rail Riders, Sweet Sleuth and Goomba Wrangler! When players are tired of exploring the story mode, they can choose one of the other modes, like Puzzle and Minigame. Play with up to four friends on the DS' local Wi-Fi and let the party begin. [Nintendo]",72,7.9,Party
77,110171,https://www.metacritic.com/game/wii/rayman-raving-rabbids-2,https://static.metacritic.com/images/products/games/1/c1780ff17c766e4aa2f27ede7c883636-98.jpg,Rayman Raving Rabbids 2,Wii,"November 15, 2007","After invading the world of Rayman, the insane Rabbids have a new objective: THE INVASION OF PLANET EARTH! Setting their home base at a shopping mall, the Rabbids try to study human behavior and mimic everything humans do in funny, illogical ways. As part of their training, the Rabbids must carry out several missions around the globe to prepare themselves for world domination. Rayman will attempt to infiltrate the Rabbids, disguised as one of them, in a mission to foil their crazy plans and save Earth. Game features include: 60 brand-new games that spoof popular culture and are even wackier than those featured in the first Rayman Raving Rabbids. Unique use of the Wii Remote – Discover new, innovative ways to play, with eight types of gameplay, including shaking, precision, dexterity and balance. Travel around the world - Take Rayman on a world tour to defend Earth from the Rabbids invasion. Travel to five different regions such as the USA, Europe and Asia, where players will challenge the Rabbids in the local environments. Customize Rayman and the Rabbids - Use more than 110 items (skins, hats, accessories and clothes) to dress Rayman and create your own Rabbids. Unleash your creativity with over 540K customization combinations. Multiplayer experience – Play co-op or battle up to three friends in all the games unlocked in the single-player campaign. [Ubisoft]",67,8.0,Party
78,110526,https://www.metacritic.com/game/ds/jenga-world-tour,https://static.metacritic.com/images/products/games/6/b3ac7c0cd0677d62b6e916cf685ae484-98.jpg,Jenga World Tour,DS,"November 13, 2007","Jenga is based on the world famous wooden block tower building game. Designed to make the most of the innovative control systems on the Wii and DS, the game offers unpredictable, quick- paced, tactical play that combines suspense and risk-taking, where mounting anticipation comes to a crashing climax. Players of the Wii version can get physical with the Wii Remote and Nunchuk controllers as they battle to keep the Jenga tower from falling, while on the DS the touch screen provides equally intuitive control of the fast-paced action. Players experience sophisticated physics, and a multitude of game-play options (single and multiplayer). The game contains all the fun, intensity and challenge of the original boxed game with a wealth of exciting new enhancements, power-ups and twists that are possible only in the videogame world. [Atari]",32,tbd,Party
79,110280,https://www.metacritic.com/game/ds/rayman-raving-rabbids-2,https://static.metacritic.com/images/products/games/0/089bbf94e46a456ed8103461eb95e13f-98.jpg,Rayman Raving Rabbids 2,DS,"November 13, 2007","After invading the world of Rayman, the insane Rabbids have a new objective: THE INVASION OF PLANET EARTH! Setting their home base at a shopping mall, the Rabbids try to study human behavior and mimic everything humans do in funny, illogical ways. As part of their training, the Rabbids must carry out several missions around the globe to prepare themselves for world domination. Rayman will attempt to infiltrate the Rabbids, disguised as one of them, in a mission to foil their crazy plans and save Earth. [Ubisoft]",57,6.5,Party
80,110971,https://www.metacritic.com/game/playstation-2/buzz!-junior-monster-rumble,https://static.metacritic.com/images/products/games/1/0adf35f590be95bde01ffb3498974e9e-98.jpg,Buzz! Junior: Monster Rumble,PlayStation 2,"October 31, 2007",(Currently available in the UK/EU only)  Up to four players can compete in a series of challenges to prove which of the monsters is top of the pile.,71,6.8,Party
81,110132,https://www.metacritic.com/game/wii/carnival-games,https://static.metacritic.com/images/products/games/2/378ce2ded10b334400af992b1906a498-98.jpg,Carnival Games,Wii,"August 28, 2007","Carnival Games feature 25 popular games from classic carnivals, including Clown Splash, Milk Can Toss, Nerves of Steel, Lucky Cups, Hoops, Day at the Races and Dunk Tank. Players can win over 250 upgradeable prizes ranging from a goldfish to giant stuffed animals. Character-customizing items like a pirate's wardrobe and a Viking helmet are also there to be won. The game features a fortune teller who reveals a player's fate for a price. The moment you step into Carnival Games you can almost smell the funnel cakes as you are greeted by the barker and the sights and sounds of a classic carnival. The game was built from the ground up to take full advantage of the capabilities of the Wii Remote, so the flick of your wrist in Alley Ball makes the difference between scoring an impressive 100 points and a lowly 10 points. The ability to pound the Wii Remote like a sledgehammer with the right mix of power and finesse in Test of Strength determines whether you are a Contender or a Grandma.",56,5.9,Party
82,109540,https://www.metacritic.com/game/wii/tamagotchi-party-on!,https://static.metacritic.com/images/products/games/0/36f10e6861b69d931788b6e5e2973600-98.jpg,Tamagotchi Party On!,Wii,"May 29, 2007","This 3D party game based on the Tamagotchi franchise promises tons of fun as up-to-four players can go head-to-head in the most comical and cute campaign race to become the most popular Tamagotchi on Tamagotchi Planet. Tamagotchi Party On! is a seamless blend of both party game and board game as players swing, shake, and turn their Wii controllers in order to control their favorite Tamagotchi. Swing your Wii controllers and turn the whole planet into your playing board. Tamagotchi Party On! allows players to choose their favorite virtual pet and engage in a hilarious campaign to become the next president of Tamagotchi Planet. Earn your popularity by going up against three friends or solo in over 15 unique and totally addictive mini-games including shaking hands, finding lost children, and testing your public speaking skills. In order to succeed at each of these mini games, players have to swing, shake, point, turn and twist their Wii controllers in order to increase their popularity. Gamers can also use Gotchi points that they earn along the way to level up their characters and customize their very own campaign headquarters. With over six different towns to win over and tons of popularity points to be earned in a number of fun and quirky mini-games, Tamagotchi Party On! brings out the fun in politics without all the mudslinging! Be happy! Be popular! Be president! [Namco Bandai Games]",37,3.4,Party
83,109052,https://www.metacritic.com/game/wii/mario-party-8,https://static.metacritic.com/images/products/games/2/9731e0983028b99cf10ee8e711351b46-98.jpg,Mario Party 8,Wii,"May 29, 2007","Play with motion control! Row your way down a river, punch a statue to pieces, steer race cars and mopeds, and handle a balancing pole while walking a tightrope. Play with the pointer. Drag and drop decorations onto cakes, shoot Boos in haunted house, quickly choose your answer in a game show. Mash those Wii Remote buttons. Jump and pummel your way through a football brawl, hop and run across an obstacle course of spinning platforms. Mario Party 8 includes six brand-new boards, dozens of minigames and many new modes. In a franchise first, you can collect special power-ups and transform your character into a boulder that smashes rivals or a coin-sucking vampire. Mario Party 8 includes ""extra-large"" minigames like Star Carnival Bowling and Table Menace. [Nintendo]",62,6.6,Party
84,109047,https://www.metacritic.com/game/wii/wii-play,https://static.metacritic.com/images/products/games/7/7c8578fe66871826597a63f71e7c625a-98.jpg,Wii Play,Wii,"February 12, 2007","In Wii Play, the star of the game is you. Create your own personal Mii character with the Wii console's built-in Mii Channel and then play as yourself in this compilation of nine simple, fun games like target shooting, table tennis and fishing. Wii Play comes bundled with a free Wii Remote, so a friend can instantly join in the action in any of the included games. You can play at home or save your Mii on your Wii Remote and play with it on a friend's console, or use any of the six ready-made guest characters. Wii Play's nine different games are the perfect introduction to what the Wii Remote can do: Shooting Range - A modern version of the Nintendo classic Duck Hunt. Shoot the targets on the screen simply by aiming your Wii Remote. Find Mii - Can you spot a face in the crowd? Use your Wii Remote to point out the correct Mii characters as quickly as you can. Table Tennis - How long can you ping pong? Use your Wii Remote like a paddle to bat the ball and try to beat the computer or human opponent. Pose Mii - Twist the Wii Remote to rotate the Mii characters and quickly slot them into the correct positions as they fall down the screen. Laser Hockey - Tilt and turn the Wii Remote to bash the puck into the opponent's goal, in this high-speed arcade-style game. Billiards - In this version of Nine Ball, aim the Wii Remote at the screen to line up your shot, then pull back and push forward to strike the ball. Fishing - Move the Wii Remote like a rod: dip the hook in the water, wait for the fish to bite (the controller will rumble) and pull back hard to land it. Charge - Take the bull by the horns! Steer your wild steer by holding the Wii Remote sideways, as if gripping reins, and topple scarecrows to score points. Tanks - Take control of a tank with the Wii Remote; aim the cannon, bounce shells off walls, and blast your opponent to bits. [Nintendo Europe]",58,6.6,Party
85,108809,https://www.metacritic.com/game/xbox-360/fuzion-frenzy-2,https://static.metacritic.com/images/products/games/9/f70d06ba706aa6197c5a9984b2d2d844-98.jpg,Fuzion Frenzy 2,Xbox 360,"January 30, 2007","With huge prize money and a chance to save the planet on the line, its your turn to appear on the worldwide hit TV sensation Fuzion Frenzy. Spanning seven planets across the galaxy, you compete in 40 different mini-games - from sports challenges to thrilling battles - in your quest to become the ultimate victor. Frenetic social entertainment with 40 different challenges on one disc. Jump-in easy-to-play controls and fun filled game play reward all levels of gamer from the casual to the advanced player. Now on Xbox Live and packed with Xbox Live features such as head-to-head muliplayer, tournament customization and much, much more. Includes new variations of the favorite games from the original Fuzion Frenzy revamped and improved for the Xbox 360. [Microsoft]",49,5.4,Party
86,108298,https://www.metacritic.com/game/wii/warioware-smooth-moves,https://static.metacritic.com/images/products/games/8/5866e54962ddba053ad7547ec8960efd-98.jpg,WarioWare: Smooth Moves,Wii,"January 15, 2007","Wario and his pals learn fun, wacky moves after discovering a strange book and a mystical device called the Form Baton. Familiar characters from the WarioWare universe will return to this installment and some new ones will appear. Players must clear fast-paced sets of microgames, changing the way they hold the Wii Remote each time. As they do, they'll unlock more microgames and souvenirs. The WarioWare team took an idea so wacky, it could only be made with the latest technology ... the Wii Remote. WarioWare is back with a whole new set of moves. When Wario stumbles upon a strange device called a Form Baton, he and his friends use it to learn new moves that are as fun as they are wacky. With hundreds of microgames, this game is just as wild as you'd expect from the name WarioWare, but the game play has been revolutionized. Under Wario's tutelage, and with the help of the Wii Remote, players will swing, spin and squat their way to victory. With about 200 lightning-quick microgames and controls that range from scribbling to flailing, WarioWare: Smooth Moves takes interactive gaming to a whole new level. All players need is a Wii Remote and their best moves to be the champ. [Nintendo]",83,7.6,Party
87,108186,https://www.metacritic.com/game/wii/super-monkey-ball-banana-blitz,https://static.metacritic.com/images/products/games/6/230645382bd3e4a2e177085f4829b29a-98.jpg,Super Monkey Ball: Banana Blitz,Wii,"November 14, 2006","The single-player puzzle levels in Super Monkey Ball: Banana Blitz have been designed to challenge gamers' skills like never before. For the first time in the Super Monkey Ball franchise, AiAi and his friends have the ability to jump when players flick the Nintendo Wii controller in an upward motion. The ability to jump has given game designers another dimension in which to expand the Super Monkey Ball gameplay experience and allows gamers a whole new way to interact with the franchise; this time in true three-dimensional fashion. The Party Games return with more variety than ever. An abundance of new Party Games have been designed to take advantage of the Wii controller in a multitude of ways. Gamers find themselves competing in a traditional game of ring toss, or even smacking pesky moles in a game of ""Whack-a-Mole."" [Sega]",74,5.8,Party
88,108253,https://www.metacritic.com/game/wii/rayman-raving-rabbids,https://static.metacritic.com/images/products/games/3/91f49e286be47a6d4631fe136461ccf8-98.jpg,Rayman Raving Rabbids,Wii,"November 14, 2006","Rayman Raving Rabbids marks the return of the iconic video-game hero, Rayman, in his funniest and zaniest adventure ever. When the world of Rayman is threatened by a devastating invasion of crazed, out-of-control bunnies Rayman must rise up against his furry foes to foil their wicked plans. Utilizing an array of amazing new abilities, and with the help of magical creatures, Rayman must break out all the moves to save his world from these delirious bunnies and their hare-raising antics. Combat the Ultra-Crazed Evil Rabbits – Take control of Rayman and his knack for attack to help save his world from the raving rabbids. They are mischievous, insane and completely out of control. There are several types of rabbids each with its own mischievous characteristics. Tame and control various creatures such as sharks, eagles, rhinos, spiders and angelfish. Rayman can master each animal's unique capabilities to help in his battle against the devious rabbits. Customize and disguise Rayman. Go punk, pop, rock or hip hop to infiltrate the bunnies and foil their devious plans. Explore amazing free-roaming environments and beautiful epic landscapes that mix real and fantastical styles to create a visually stunning experience. [Ubisoft]",76,7.8,Party
89,108119,https://www.metacritic.com/game/ds/crash-boom-bang!,https://static.metacritic.com/images/products/games/9/8822829770128ef42aad45318af397f7-98.jpg,Crash Boom Bang!,DS,"October 10, 2006","In Crash Boom Bang!, Crash and his friends embark on a worldwide race in a quest for its multi-million dollar prize.  With hidden intentions of finding an ancient lost city and the famed magical ""Super Big Power Stone"" that grants its user one wish, the race’s sponsor Viscount Devil plans on using the contestants to solve the mystery.  The map of the race checkpoints is based on the Viscount’s ancient map, and the evil Dr. Neo Cortex, also an invitee to the race, has figured out the Viscount’s master plan and in his own relentless pursuit for world domination, sets out to steal the map and retrieve the legendary stone.  It’s up to Crash and his friends to win the big race ... and save the world! [Vivendi]",37,4.3,Party
90,107267,https://www.metacritic.com/game/ds/super-monkey-ball-touch-roll,https://static.metacritic.com/images/products/games/7/c0b415239824513064d66339d8429304-98.jpg,Super Monkey Ball: Touch & Roll,DS,"February 21, 2006","Touch & Roll combines the Monkey Ball series' legendary addictiveness with perhaps the perfect platform in the form of the Nintendo DS and its touch-screen technology. Ten crazy worlds with 10 levels each offer 100 puzzle trays designed to frustrate and delight - 50 of which are all new and DS exclusive. Use the DS stylus and touch screen to guide AiAi, MeeMee, GonGon and Baby through this slice of monkey madness. Four classic party games playable in both single and multiplayer modes - Monkey Race, Monkey Fight, Monkey Mini Golf and Monkey Bowling. Two all-new DS exclusive party games - Monkey Hockey and Monkey Wars. Wireless multiplayer via ad-hoc Wi-Fi connectivity. [Sega]",63,7.7,Party
91,105245,https://www.metacritic.com/game/psp/ape-escape-academy,https://static.metacritic.com/images/products/games/5/2b348c3d8af9119406eba444b2c2f245-98.jpg,Ape Escape Academy,PSP,"January 17, 2006","Compete in more than 40 mini-games including hockey, golf, dodge ball, karate and more, with a wide variety of game styles, each brimming with frantic fun and wacky-humor. Featuring Wi-Fi wireless LAN (Ad Hoc) connectivity, up to four players with a PSP and the game can challenge each other.",51,6.1,Party
92,162848,https://www.metacritic.com/game/gamecube/mario-party-7,https://static.metacritic.com/images/products/games/8/07efcf4393a33a7c54c218d324b638ca-98.jpg,Mario Party 7,GameCube,"November 7, 2005","You can play more than 80 new minigames in the most recent Mario-themed party game, Mario Party 7. Mario and pals needed some time off, but they forgot to invite Bowser on their cruise. You can battle against an angry Bowser or up to seven of your friends on a single GameCube system. Mario Party 7 includes a few new characters and brings back microphone support from Mario Party 6.",64,7.7,Party
