,id,url,image,title,platform,release_date,summary,metascore,userscore,genre
40,177370,https://www.metacritic.com/game/wii/wii-play-motion,https://static.metacritic.com/images/products/games/0/4870052ad1da4359196c269b9138df18-98.jpg,Wii Play: Motion,Wii,"June 13, 2011","With the June 13 launch of Wii Play: Motion, Wii owners will be twisting, turning and enjoying themselves like never before, whether they're newcomers to the console or have already discovered the fun of the popular Wii Play game. From catching a gust of wind by tilting an umbrella to fending off garden pests by swinging a mallet, each of the 12 included games will have players smiling wide as they use their Wii Remote Plus controller (or Wii Remote with Wii MotionPlus™ accessory) in a variety of interesting, sometimes unexpected ways. Wii Play: Motion comes packaged with a Wii Remote Plus controller – which combines the original Wii Remote controller with the precision of Wii MotionPlus – to deliver great value, precise motion control and immersive social fun that anyone in the household can pick up and instantly enjoy.",60,6.4,Party
41,143286,https://www.metacritic.com/game/playstation-3/yoostar-2-in-the-movies,https://static.metacritic.com/images/products/games/6/effa195a51db2e6b0c4b7dfb1bfc51ab-98.jpg,Yoostar 2: In The Movies,PlayStation 3,"March 8, 2011","Yoostar2 Combines The Power Of New Console Platforms, Top Hollywood Movies And The Burgeoning Social Media Phenomenon Monday 14th June/... Everyone now has the opportunity to become a global movie star with Yoostar2. In an instant you can step into the shoes of famous characters from hundreds of movies, play out the part and then share your performance with the world.",54,tbd,Party
42,143287,https://www.metacritic.com/game/xbox-360/yoostar-2-in-the-movies,https://static.metacritic.com/images/products/games/7/de2a4c9d44d40f030702044175bd06d3-98.jpg,Yoostar 2: In The Movies,Xbox 360,"March 8, 2011","Yoostar2 Combines The Power Of New Console Platforms, Top Hollywood Movies And The Burgeoning Social Media Phenomenon Monday 14th June/... Everyone now has the opportunity to become a global movie star with Yoostar2. In an instant you can step into the shoes of famous characters from hundreds of movies, play out the part and then share your performance with the world.",50,3.7,Party
43,143301,https://www.metacritic.com/game/xbox-360/game-party-in-motion,https://static.metacritic.com/images/products/games/1/5b0b899d156589e4f5879f370b559679-98.jpg,Game Party: In Motion,Xbox 360,"November 18, 2010","Game Party: In Motion lets players engage in true-to-life motions with games appealing to people of all ability levels, ranging from sports like Hoop Shoot and Darts to arcade and party games including Rootbeer Tapper, Table Hockey and more. Players mimic the actions and gestures of real-life activities allowing them to move their arms, legs or full bodies in natural motions to control the game.",33,3.3,Party
44,155240,https://www.metacritic.com/game/wii/namco-museum-megamix,https://static.metacritic.com/images/products/games/0/db8e7b49685fc701aee1170364ba37c7-98.jpg,Namco Museum Megamix,Wii,"November 16, 2010",Namco Museum Megamix gives players a new take on classic franchises while staying true to the core gameplay that made them so popular. Each game will deliver a unique experience with updated Pac-Man themed graphics and specially designed Wii motion controls that will have gamers of all skill levels wanting to join in on the fun.,53,7.8,Party
45,143319,https://www.metacritic.com/game/wii/pac-man-party,https://static.metacritic.com/images/products/games/9/846b175f3a6e0547bc01b678e73efcdb-98.jpg,Pac-Man Party,Wii,"November 16, 2010","Reigning as one of the top pop cultural icons since his introduction in 1980, PAC-MAN remains a global phenomenon that has yielded hundreds of products including video games. PAC-MAN Party continues this legacy by offering a game that captures the spirit of the franchise and provides engaging entertainment that can be enjoyed by people of all ages. With more than 45 exciting mini-games, PAC-MAN Party provides a rewarding and challenging social gaming experience regardless of skill level. From the time-based trials of rolling a giant snowball and knocking your friends off a mountain top, to adventures that require more precision and endurance, players will be fully engaged as they use the Wii Remote's motion, pointing and button control capabilities.",59,6.1,Party
46,154728,https://www.metacritic.com/game/wii/pictionary,https://static.metacritic.com/images/products/games/8/dd31d7cee98eb6ac7a1e0322c7f5aab2-98.jpg,Pictionary,Wii,"November 14, 2010","Pictionary, the game of quick sketches and crazy guesses, has innovative new functionality and game modes for the whole family! In addition to great classic Pictionary play, new features include rotating canvases, one-line challenges and other fun gameplay modes in a lively game show setting.",71,tbd,Party
47,150437,https://www.metacritic.com/game/wii/wii-party,https://static.metacritic.com/images/products/games/7/cbbb84f71266451b05e67ca229f8fbd9-98.jpg,Wii Party,Wii,"October 3, 2010","Most video games require players to focus their attention on a screen. Now Nintendo brings the action into the living room with Wii Party, a game that changes the way people interact with other players. Featuring 13 different party game modes and 70+ minigames, Wii Party can be enjoyed by everyone in the family, regardless of age.",68,8.0,Party
48,150934,https://www.metacritic.com/game/xbox-360/truth-or-lies,https://static.metacritic.com/images/products/games/4/fd9cb47b5ebd0bbddde494000d87abd0-98.jpg,Truth or Lies,Xbox 360,"September 14, 2010","Friends and family will be squirming in their seats as they answer some of the game's silliest and most provocative questions in the new Truth or Lies video game.  Up to eight players can join in on this party game, as they offer up answers to more than 3,000 questions.  Additionally, the Hot Seat mode will allow players to put other players on the spot and ask them any question that comes to mind.  The gameplay will lead to revealing and hilarious situations among friends and family.",28,4.4,Party
49,146728,https://www.metacritic.com/game/playstation-3/start-the-party!,https://static.metacritic.com/images/products/games/8/877420dedf1652d92b6dd6f0fe6a1cd6-98.jpg,Start the Party!,PlayStation 3,"September 7, 2010","Step into an animated augmented virtual reality in Start The Party!, a collection of interactive social party games for the whole family. Start The Party! transforms the PlayStation Move motion controller into an array of virtual props that players hold in their hand to twist, cut, swat, paint, pop, and jab their way through a series of fast-paced challenges requiring skill, speed and precision. Players are fully immersed into Start The Party! as the PlayStation Eye displays the players and their surroundings within the game's colorful user interface, making them the star of the game.",55,5.8,Party
50,142910,https://www.metacritic.com/game/wii/disney-guilty-party,https://static.metacritic.com/images/products/games/0/fe904e8f50e5aa06875f05ce17a1be7e-98.jpg,Disney Guilty Party,Wii,"August 26, 2010","Disney Guilty Party is a fun and hilarious mystery party game, exclusively for Wii.  Friends and family play as the savvy sleuths of the world-famous Dickens Detective Agency to investigate a series of crimes and identify the guilty party.",78,8.0,Party
51,142848,https://www.metacritic.com/game/wii/warioware-diy-showcase,https://static.metacritic.com/images/products/games/8/49c19fbe43f983a92c143fae840dc912-98.jpg,WarioWare D.I.Y. Showcase,Wii,"March 29, 2010","[WiiWare]  WarioWare: D.I.Y. Showcase is a standalone product exclusive to the WiiWare service and available only from the Wii Shop Channel. The game contains more than 70 new microgames and features interoperability with theWarioWare: D.I.Y. game for the Nintendo DS family of products. Players that own both games can transfer content between the two via a local wireless connection, and can even play user-created microgames on their television using WarioWare: D.I.Y. Showcase. [Nintendo]",73,7.8,Party
52,146655,https://www.metacritic.com/game/wii/happy-hammerin,https://static.metacritic.com/images/products/games/5/a8d0c5771e787ac289b1b01156e7fe86-98.jpg,Happy Hammerin',Wii,"March 1, 2010","[WiiWare]  Happy Hammerin' is a party game suitable for friends and families. Compete against each other by bashing moles using the Wii Remote controller. Use the Wii Remote like a hammer and let off some steam as you frantically try to bash the moles popping up all over the screen. Play against the CPU or go head-to-head with up to four players. (Additional accessories are required for the multiplayer modes and are sold separately.) Players can challenge themselves in three different modes: Mole Adventure (1-2 players), Mole Marathon (1 player) and Party Battle (1-4 players). Mole Adventure consists of four stages with three difficulty types. The faster you bash, the more points you get. With broadband Internet access, register your scores online and compete against the best mole bashers from around the world.",52,tbd,Party
53,134651,https://www.metacritic.com/game/ds/faceez,https://static.metacritic.com/images/products/games/1/9557fed37b4a1631aa7ca1255862ae1b-98.jpg,Faceez,DS,"February 22, 2010","[DSiWare]  Make your friends laugh with Faceez. Take pictures of their faces with the Nintendo DSi Camera and then mix them and animate them. Dress them up with lots of funny accessories. Place them in your own favorite settings. Give free reign to your imagination with millions of possible combinations. Thanks to the Nintendo DSi system's connectivity with Facebook, you can share your creations with your friends, who'll be rolling on the floor laughing. Photograph, disguise, decorate, animate and send ... FACEEZ. [Nintendo]",53,tbd,Party
54,115209,https://www.metacritic.com/game/ds/hasbro-family-game-night,https://static.metacritic.com/images/products/games/9/013b91caf78d238499ca6d6e5e2db44c-98.jpg,Hasbro Family Game Night,DS,"October 26, 2009","Battleship, Connect4, BobIt!, and Operation.",57,tbd,Party
55,115210,https://www.metacritic.com/game/wii/hasbro-family-game-night-2,https://static.metacritic.com/images/products/games/0/dc104858d70e5d1319c88e942aaee527-98.jpg,Hasbro Family Game Night 2,Wii,"October 26, 2009","Everyone's favorite spud is back in HASBRO FAMILY GAME NIGHT 2 for the Nintendo Wii, and now he's got more moves than ever!  With new games like OPERATION, JENGA, BOPPIT, PICTUREKA and CONNECT 4x4, Mr. Potato head is so excited about the release of the popular family Wii game that he’s getting his boogie on to celebrate. [Electronic Arts]",63,6.4,Party
56,115155,https://www.metacritic.com/game/wii/game-party-3,https://static.metacritic.com/images/products/games/5/06c9714282a507747399b02876e92a5d-98.jpg,Game Party 3,Wii,"October 6, 2009","Engage every member of your party in exciting competitions for every ability level. Up to four players can face off simultaneously and battle for the top score and up to 16 players can play in bracketed tournaments so everyone can get in on the action. Early adopters as well as new fans of the franchise will appreciate that Game Party 3 has something for everyone. The game features eight new party favorites including Billiards, Bumper Pool, Mini Golf, Smack-a-Troll, Bocce Ball, Racquetball, Croquet, and a remake of the arcade classic Root Beer Tapper. Returning party games include Darts, Hoop Shoot, Ping Cup, Shuffleboard, Skill Ball, Trivia, Puck Bowling, Horseshoes, Beanbags, QB Challenge and Lawn Darts. Players can revisit these classic Game Party games with new level layouts as well as a revamped database of challenging original trivia. Game Party 3 makes full use of the Wii Remote, using intuitive gameplay controls so anyone can pick up and play to join the party. Players can customize their avatar appearance and character profiles using the Create a Player and Profile features allowing gamers to track high scores and earn game tickets, which can be used to unlock special in-game equipment and additional create-a-player attributes. [Warner Bros.]",37,4.5,Party
57,114405,https://www.metacritic.com/game/wii/disneypixar-toy-story-mania!,https://static.metacritic.com/images/products/games/5/85bf6ee01099c731125d185ad0a03a60-98.jpg,Disney/Pixar Toy Story Mania!,Wii,"September 15, 2009","In Toy Story Mania!, players experience the fast-paced, zany fun of the Toy Story Mania! theme park attraction, which is an interactive experience requiring 3D glasses and involving rapid or quick-firing shooting galleries. In addition to galleries adapted from the attraction, the game includes new and original galleries and a series of mini games, all hosted by beloved characters from the movies. The thematically-connected levels are designed for up to four players of all ages with competitive and co-operative multiplayer options. Toy Story Mania! also includes bonus 3D features, transforming the game experience with eye-popping visuals. [Disney]",49,6.1,Party
58,114541,https://www.metacritic.com/game/wii/drill-sergeant-mindstrong,https://static.metacritic.com/images/products/games/1/722610dde75661f1d61c1fba1f76de47-98.jpg,Drill Sergeant Mindstrong,Wii,"June 22, 2009","[WiiWare; also known as ""Brain Cadets""]  Line up and get ready to use your mind. Drill Sergeant Mindstrong is a party game that allows up to four people to play at once. Players become boot-camp trainees under the tough Drill Sergeant Mindstrong, going through mind-boggling, mind-training games. The rules are simple, but concentration and quick thinking are key. Become the top boot of your class and earn promotions based on your efforts. This game is best played with friends and family. [XSEED]",46,tbd,Party
59,113321,https://www.metacritic.com/game/wii/lets-tap,https://static.metacritic.com/images/products/games/1/58d34078f5ebe90221201baa0d90ea16-98.jpg,Let's TAP,Wii,"June 12, 2009","Let's Tap is an innovative gaming experience on the Wii with easy to pick-up-and-play controls that will appeal to gamers of all ages. Simply place the Wii Remote on a box or a flat surface and tap! All methods of tapping (light, medium, hard) will allow you to jump hurdles and create environmental effects such as a dazzling fireworks display. There are five fun-filled game modes, all of which allow for multiplayer fun. PICK-UP-AND-PLAY CONTROLS: Every member of the family can jump into the game with these simple controls. Players place their Wii Remote on a box or flat surface and tap through five gameplay modes. FIVE UNIQUE GAME MODES: Tap Runner: Sprint for the finish line in over 16 courses while avoiding obstacles including hurdles, ice wall and electric fields. (1-4 players) Rhythm Tap: There are a wide range of songs to master in Rhythm Tap. Feel the beat and tap light, medium, hard in sync with the on-screen tap indicators. (1-4 players) Silent Blocks: Different modes using light and hard taps to strategically remove blocks one at a time from the column without causing it to topple over. (1-4 players) Bubble Voyager: Clad in a space suit, solo players tap to keep their character afloat through many levels filled with dangerous objects; a double tap will launch a missile. In multiplayer matches, you will shoot each other a number of times to win. (1-4 players) Visualizer: Everyone will take their turn with several Unique stages including Fireworks, Paint, River, Gem Game and Ink. Tapping with light, medium and hard strokes produces on-screen effects ranging from a fireworks display to undersea bubbles. In special tap sequences, various sea animals will appear. (1 player) [Sega]",70,6.7,Party
60,113237,https://www.metacritic.com/game/wii/neighborhood-games,https://static.metacritic.com/images/products/games/7/66075ec55c5802a0d5580d6b6a19451f-98.jpg,Neighborhood Games,Wii,"January 12, 2009","Play 24 unique twists on classic neighborhood games including Football, Golf, Tennis, Ladder Golf, Lawn Darts, Horseshoes, Bocce, and more. Fine tuned controls. Enjoy intuitive controls for a pick up and play experience for the whole family-use the Wii Remote to throw the football, shoot the basketball, toss the horseshoe and roll the bocce ball just to name a few. Conquer the neighborhood! Play by yourself or challenge your friends and family. Taunt your opponents! From the sidelines, break their concentration and giving yourself the advantage. Become part of the neighborhood! Create your own fully customizable, playable characters with endless combinations. [THQ]",49,7.0,Party
61,112778,https://www.metacritic.com/game/wii/calvin-tuckers-redneck-jamboree,https://static.metacritic.com/images/products/games/8/ce9dfd120d1e289908a3898a300b43e1-98.jpg,Calvin Tucker's Redneck Jamboree,Wii,"December 19, 2008","Every year, the people of Redneck County gather to compete in the great Redneck Jamboree! Come join them, and test your redneck skills in 12 hilarious events to gain more bottle caps then any of the four families participating to become the greatest family of the county for a year. Not only will you get bragging rights, but you'll also get the privilege to move in ""The Big Trailer"" where fabulous redneck luxuries await. Saddle up, partner, it's going to be a bumpy ride. [Zoo Games]",26,tbd,Party
62,113228,https://www.metacritic.com/game/wii/family-party-30-great-games,https://static.metacritic.com/images/products/games/8/35cba259ab3f4b8a3150eb8b19af95bd-98.jpg,Family Party: 30 Great Games,Wii,"December 2, 2008","Fun for kids of all ages, Family Party: 30 Great Games lets up to 4 players participate in wide variety of fun and addictive party games. It features everything from track and field, to playground games, to shooting games. Customized for the Wii Remote, it showcases the variety of gameplay and madcap action possible on the Wii.",42,2.2,Party
63,112399,https://www.metacritic.com/game/wii/rayman-raving-rabbids-tv-party,https://static.metacritic.com/images/products/games/9/d70c21775708338f12390da0293fdf3d-98.jpg,Rayman Raving Rabbids: TV Party,Wii,"November 18, 2008","First they invaded the world and, now your TV. The Rabbids have taken over almost every channel you can imagine, from music to movies – even TV ads. Help the Rabbids destroy all our daily viewing and drive Rayman crazy. In Story Mode, play through a week of television, with each day bringing new wacky challenges of skill and insane movements in a compilation of mini-games. With up to eight players in turn-based mode and four players simultaneously, get ready for you and all your friends to go insane. Unique use of the Wii Balance Board: Play loads of exciting new games with the new Wii Balance Board and experience the first game in the world that you can play with your rear end. New wacky games. 65+ brand-new games that spoof popular culture, from TV series to TV classics, not to mention insane ads. Play co-op or battle your friends simultaneously with up to four players, or go crazy with up to eight players in party mode. You can even sabotage your friends while they are playing. Unique use of the Wii Remote. Discover new and innovative ways to play with eight types of gameplay, including shaking, precision, dexterity and balance. Shake that Rabbid. Use the Wii Remote and Wii Balance Board to dance and wiggle your booty. Customize your bunny. Pimp your bunny out, take his photo and send it to your friends online. [Ubisoft]",73,7.1,Party
64,111973,https://www.metacritic.com/game/playstation-3/age-of-booty,https://static.metacritic.com/images/products/games/3/4641a0106bfa7e764c3d11073c1bf7ea-98.jpg,Age of Booty,PlayStation 3,"October 16, 2008","[Playstation Network]  Set in the swashbuckling era, Age of Booty is a casual real-time multiplayer strategy game that puts players at the helm of their own pirate ship with the goal of sending your enemies to the briny deep, and looting and capturing towns for your pirate faction. In Age of Booty, players team up with other online players or AI-controlled pirate ships to raid, pillage, sink, and destroy their way to dominance on the high seas. Spoils of war and booty are used to upgrade and customize pirate ships to make them even more deadly as players take on 25 unique challenges and seven of the most devious Pirate Alliances on the high seas. Gain notoriety and fame by climbing the online leader boards. Create and share custom maps using the intuitive map creation system. Single player and multiplayer real-time action strategy from Certain Affinity, lead by Max Hoberman, designer of Halo 2 and 3's multiplayer game. Raid villages, sink merchants, seize towns, steal gold, upgrade your pirate ship and use your guns and your wits to send your foes to the briny deep. Master twenty-five unique multiplayer maps or create your own and share them with your friends. Up to four players on one console, up to eight players over LAN or the Internet. Tons of customizable options that allow you to tune the game to meet your taste. [Capcom]",74,5.7,Party
65,111972,https://www.metacritic.com/game/xbox-360/age-of-booty,https://static.metacritic.com/images/products/games/2/c133dae45166b619a084c2a3febeedfd-98.jpg,Age of Booty,Xbox 360,"October 15, 2008","[Xbox Live Arcade]  Set in the swashbuckling era, Age of Booty is a casual real-time multiplayer strategy game that puts players at the helm of their own pirate ship with the goal of sending your enemies to the briny deep, and looting and capturing towns for your pirate faction. In Age of Booty, players team up with other online players or AI-controlled pirate ships to raid, pillage, sink, and destroy their way to dominance on the high seas. Spoils of war and booty are used to upgrade and customize pirate ships to make them even more deadly as players take on 25 unique challenges and seven of the most devious Pirate Alliances on the high seas. Gain notoriety and fame by climbing the online leader boards. Create and share custom maps using the intuitive map creation system. Single player and multiplayer real-time action strategy from Certain Affinity, lead by Max Hoberman, designer of Halo 2 and 3's multiplayer game. Raid villages, sink merchants, seize towns, steal gold, upgrade your pirate ship and use your guns and your wits to send your foes to the briny deep. Master twenty-five unique multiplayer maps or create your own and share them with your friends. Up to four players on one console, up to eight players over LAN or the Internet. Tons of customizable options that allow you to tune the game to meet your taste. [Capcom]",76,7.2,Party
66,112690,https://www.metacritic.com/game/wii/game-party-2,https://static.metacritic.com/images/products/games/0/62e1886e015bcf8f5010a851c6250632-98.jpg,Game Party 2,Wii,"October 6, 2008","[Also known as ""More Game Party"" in the UK/EU]  With 11 games in all, Game Party 2 for the Nintendo Wii includes fun to play games that will provide hours of enjoyment with friends and family. Game Party 2 features new games like Bean Bags, Horseshoes, Lawn Darts, Puck Bowling and more. Each game, including classics like Skill Ball, Darts and Hoop Shoot has exciting new features like four player mode, customizable characters and tournament play, making Game Party 2 the ultimate party game for all ages and skill levels. [Midway]",29,5.8,Party
67,111517,https://www.metacritic.com/game/wii/wonder-world-amusement-park,https://static.metacritic.com/images/products/games/7/2a5970feed51cac44f26ad79527f307d-98.jpg,Wonder World Amusement Park,Wii,"July 8, 2008","All of the fun and thrills of your favorite amusement parks and carnivals are now available in your living room. In Wonder World Amusement Park, you can take your customized character through a fully 3D park with five themed zones and hop on five heart-pounding interactive rides. Play through a huge variety of mini-games as you win outfits and prizes for your unique character. Step right up and test your skills in a fun filled experience for the whole family. [Majesco]",37,4.5,Party
68,109691,https://www.metacritic.com/game/xbox-360/hail-to-the-chimp,https://static.metacritic.com/images/products/games/1/8cdd0e24b321c37eff5dd1abfadef13f-98.jpg,Hail to the Chimp,Xbox 360,"July 2, 2008","Since the dawn of time, Man has wondered who would win if a polar bear and jellyfish teamed up to fight an armadillo and yak. Do you have what it takes (approximately $40) to learn the shocking truth? When the King of the Animals is forced to resign in disgrace, a motley group of candidates turns out for a bare-knuckle campaign to win the Crown. From Ptolemy, the mighty hippo, to Crackers, the devious monkey, each of the ten candidates has distinct strengths and strategies, but the same hunger for political power. Hail to the Chimp is a party game that delivers exciting gameplay, lush interactive environments, and a comic look at politics. Players use the game’s unique team-up mechanic, mixing cooperation with competition, to claw their way to victory. Whether played by four friends on one TV, online against distant challengers or single-player against advanced AI, Hail to the Chimp offers endlessly replayable party fun for gamers of all stripes. [Gamecock Media]",52,6.1,Party
