,id,url,image,title,platform,release_date,summary,metascore,userscore,genre
0,161437,https://www.metacritic.com/game/gamecube/mario-party-4,https://static.metacritic.com/images/products/games/7/ac01c7de58aa22d13a4773c632c33b2d-98.jpg,Mario Party 4,GameCube,"October 21, 2002","Toad, Koopa, and other party-planning pranksters have hidden birthday presents for their closest friends inside the Party Cube.  To win the presents, Mario, Yoshi, Peach, and other Mushroom Kingdom favorites will have to plunge into a circus of minigame trickery.  As always, keep an eye out for Bowser and his trouble-making goons.  Even Whomp and Thwomp have rockin' surprises for you in their Extra Room.  Packed with surprises, wild multiplayer action, and zany challenges, Mario Party 4 is your ticket to a good time.",70,7.7,Party
1,161365,https://www.metacritic.com/game/xbox/whacked!,https://static.metacritic.com/images/products/games/5/85f406061d08f00e24251d8b10a67bd1-98.jpg,Whacked!,Xbox,"October 8, 2002","In Whacked! you are one of seven demented contestants competing on a dangerous game show. Pitted against each other in free-for-all combat, contestants must use power-ups and weapons, such as giant staplers and rubber ducky grenades, to flatten their opponents. The game's various modes have you fighting to collect resources, fending off a horde of man-eating chickens, or exchanging blows in fierce deathmatches. There are more than a dozen levels--including an arctic pipeline, a Christmas tree, and a kitchen sink--for you to conquer.",59,7.2,Party
2,161230,https://www.metacritic.com/game/gamecube/rayman-arena,https://static.metacritic.com/images/products/games/0/8c4ae36e2452ed25bdae6a232b7fffef-98.jpg,Rayman Arena,GameCube,"September 24, 2002","Rayman Arena puts you in a competitive crash course. As any member of the cast of Rayman 2, you must smoke the competition on challenging race courses or incite a firefight in the battle arena. Take risks, use tricks, and trip up opponents as you sprint, slide, climb, and helicopter through 12 courses in an all-out rush for the checkered flag. Each of the gladiator-style arenas features its own set of power-ups, traps, and special ammo. You can also compete with up to four players in multiplayer action.",60,7.7,Party
3,161794,https://www.metacritic.com/game/game-boy-advance/barbie-groovy-games,https://static.metacritic.com/images/products/games/4/d2a9e40fb82c2997443f90f8c39971fd-98.jpg,Barbie Groovy Games,Game Boy Advance,"September 4, 2002",This is a collection of mini games starring Barbie.,47,6.4,Party
4,161493,https://www.metacritic.com/game/gamecube/pac-man-fever,https://static.metacritic.com/images/products/games/3/7fa572f9c6ea412f3e110c09a922053e-98.jpg,Pac-Man Fever,GameCube,"September 3, 2002","Pac-Man takes break from eating dots and ghosts in the fun new party game Pac-Man Fever.  In addition to our yellow hero, the game also features Ms. Pac-Man and many other Namco favorites from franchises such as Tekken, Ridge Racer, and Soul Calibur.  Up to four players partake in more than 30 minigames and three differently themed game boards.  Try to recover all of the minigames stolen by those pesky, party-crashing Ghosts and determine who the real party animal is.",54,6.9,Party
5,102248,https://www.metacritic.com/game/playstation-2/pac-man-fever,https://static.metacritic.com/images/products/games/8/fb63bb15509b373176f1eddb3cec2312-98.jpg,Pac-Man Fever,PlayStation 2,"September 2, 2002","The outrageously fun party game stars Pac-Man, Ms. Pac-Man and many other Namco favorites from popular franchises such as Tekken, Ridge Racer and Soul Calibur. Up to four players partake in more than 30 mini-games and three differently themed game boards. Try to recover all of the mini-games stolen by those pesky, party-crashing Ghosts and determine who the real party animal is! [Namco]",47,6.0,Party
6,161472,https://www.metacritic.com/game/gamecube/super-monkey-ball-2,https://static.metacritic.com/images/products/games/2/189579ef87ceda56a4a9e74f8184dc5e-98.jpg,Super Monkey Ball 2,GameCube,"August 25, 2002","AiAi, MeeMee, Baby, and GonGon are on a roll again.  Super Monkey Ball 2 brings the party to a whole new level with six brand new party games, six revamped party games, a new Story mode, and 150 new main game stages.  In the new Story mode, you'll fight as AiAi to stop the evil plans of the deranged scientist, Dr. Bad-Boon and his mysterious sidekick.  But Story mode is just the beginning--you'll want to grab some friends and get groovin' with the 12 new party games.  With its new modes, enhanced graphics, and exciting multiplayer features, Super Monkey Ball 2 is keeps your party guests going bananas for hours.",87,8.3,Party
7,161321,https://www.metacritic.com/game/playstation/rayman-rush,https://static.metacritic.com/images/products/games/1/13a72d2b9b4d0ce35f28e738adc4b829-98.jpg,Rayman Rush,PlayStation,"March 26, 2002","Rayman's world kicks into multiplayer overdrive in this total competition crash course with the cast of Rayman 2. Smoke the competition on mind-bending racecourses, or spark up a lum-flinging firefight in the battle arena. And with 8 characters, 24 maps and up to 4 combatants, now Rayman's got more ways to reign supreme than ever.",62,5.5,Party
8,161172,https://www.metacritic.com/game/gamecube/universal-studios-theme-parks-adventure,https://static.metacritic.com/images/products/games/2/7bf8dd1f0132ffa5eb504635e283efb8-98.jpg,Universal Studios Theme Parks Adventure,GameCube,"December 18, 2001","Lights... Camera... PLAY! You're not just a visitor, you're the star in Kemco's Universal Studios™ Theme Park Adventure, a magical 3-D journey beyond the theme park rides and into an amazing realm of games based upon the most successful movies produced in Hollywood. You'll love this virtual gaming lark through the world's best movie theme park!",39,3.2,Party
9,161120,https://www.metacritic.com/game/gamecube/super-monkey-ball,https://static.metacritic.com/images/products/games/0/6859480d7ced907caa5e1f7aabdbbb51-98.jpg,Super Monkey Ball,GameCube,"November 17, 2001","Call your friends and warn your neighbors, it's time to have a ball! Go bananas with 90+ stages, multi-player madness, and 7 cool ways to play! Equal parts ""party"" and ""game"", Super Monkey Ball could be the most ""well-rounded"" game you've ever played!",87,8.0,Party
10,161023,https://www.metacritic.com/game/xbox/fuzion-frenzy,https://static.metacritic.com/images/products/games/3/0f7a61749a3381f1def46a6e63bd80c6-98.jpg,Fuzion Frenzy,Xbox,"November 14, 2001","Fuzion Frenzy combines the continuous, frenetic action of a futuristic street sport with the action-packed fun of minigames set in a dynamic 3D urban environment.  The minigames require strategy and skill to conquer and cover a variety of activities, including: playing tag, collecting and stealing orbs, racing spheres, swatting bugs, lighting fireworks, and playing hot potato with dynamite.  Six arenas and more than 45 minigames provide plenty of competitive fun for up to four players.",70,7.0,Party
11,160906,https://www.metacritic.com/game/nintendo-64/mario-party-3,https://static.metacritic.com/images/products/games/6/dc1a9df66e27f1d7662ca99a534a0f5f-98.jpg,Mario Party 3,Nintendo 64,"May 6, 2001","Mario and friends are throwing a party and you're invited. It's their biggest bash yet, with seventy totally new Mini-Games and five brand new adventure boards. You'll be the life of the party as you punch, pound and stampede right over your opponents in a multiplayer melee or go head-to-head in the new two-player duel mode. You can even unlock new characters in the one-player challenge. With so much fun and excitement, this is  a bash you'll just have to crash!",74,8.2,Party
12,160813,https://www.metacritic.com/game/dreamcast/sonic-shuffle,https://static.metacritic.com/images/products/games/3/e202323b16528f3c3d90fb922d61eade-98.jpg,Sonic Shuffle,Dreamcast,"November 13, 2000","Illumina, the Guardian Angel, needs your help. The mysterious monster Void has locked up the power of the Precioustones, and it's up to you to guide Sonic and his friends through incredible game boards to recover them. Play with up to 3 friends to find out who will be the first to save the land of Maginaryworld. Play minigames, fight bosses, work your way through special events, and more, in Sonic's latest adventure!",54,7.4,Party
13,161969,https://www.metacritic.com/game/playstation/crash-bash,https://static.metacritic.com/images/products/games/9/038b12153595546829e53ba0cf899945-98.jpg,Crash Bash,PlayStation,"November 6, 2000","Crash and his friends are back in a knockdown, drag-out arena rumble.  Get ready to ride, race, jump, throw, and battle it out to the finish in frantic, head-to-head battles, and heart-pumping chases.  Choose your favorite character, including Crash, Coco, Dr. Neo Cortex, and new baddie Rill Roo, and race for points in more than 30 competitive events.  With a Multitap, you can race up to three of your friends and show who's the top bandicoot.  It's a good old-fashioned bandicoot brawl.",68,8.0,Party
14,160697,https://www.metacritic.com/game/nintendo-64/mario-party,https://static.metacritic.com/images/products/games/7/475f3229807b58e1cf9a3de7d7ad2595-98.jpg,Mario Party,Nintendo 64,"February 8, 1999","Tensions mount for Mario and pals as each declares himself to be the one true Super Star of Marioland. Face your friends and family in a contest of strength, wits and agility as you explore 6 thriling Adventure Boards. Reveal new levels of gaming excitement as you customize your boards with speed blocks, warp blocks and other specialty items. Jam-packed with all the electricity of an entire arcade, the action comes alive for up to 4 players. So grab your friends and get ready for a wild ride because this party never ends!",79,8.1,Party
15,239941,https://www.metacritic.com/game/3ds/mario-party-island-tour,https://static.metacritic.com/images/products/games/1/19d72d17e6ac860dc1dff47010651cd4-98.jpg,Mario Party: Island Tour,3DS,"November 22, 2013","The game features seven different game boards, each with its own set of rules. The game offers 81 new mini-games that test speed, concentration and luck. In addition to the board game elements, players are be able to play mini-games exclusively or try their hands at a 30-floor tower climb, AR Card games and StreetPass battles.",57,6.0,Party
16,231966,https://www.metacritic.com/game/wii-u/wii-party-u,https://static.metacritic.com/images/products/games/6/f39f55f7cb7a43eb7a892ec031e8b963-98.jpg,Wii Party U,Wii U,"October 25, 2013",Wii Party U lets players enjoy board games and mini-games on the TV. You can play familiar tabletop games using the Wii U GamePad controller or transform your living room into a game show floor.,65,7.1,Party
17,245756,https://www.metacritic.com/game/wii-u/spin-the-bottle-bumpies-party,https://static.metacritic.com/images/products/games/6/b8b13bfd2bf1cd81260537db2beb8ded-98.jpg,Spin the Bottle: Bumpie's Party,Wii U,"August 8, 2013",Spin the Bottle: Bumpie's Party is a game for 2-8 players where players sit in a circle around a GamePad and spin a virtual bottle.,75,7.7,Party
18,213278,https://www.metacritic.com/game/wii-u/game-wario,https://static.metacritic.com/images/products/games/8/765128550b7e85f601fc32e1d04dc01b-98.jpg,Game & Wario,Wii U,"June 23, 2013",Wario and his Diamond City friends are back in action. Game & Wario (working title) features a collection of games that use only the Wii U GamePad controller. The games retain the original flair and character of the micro-games from the WarioWare series.,61,6.7,Party
19,225641,https://www.metacritic.com/game/xbox-360/kinect-party,https://static.metacritic.com/images/products/games/1/5e6f38f805323fa650db762d2fcf9a2e-98.jpg,Kinect Party,Xbox 360,"December 17, 2012","Remake your living room into the ultimate Kinect Party. Immerse yourself and up to six others in this augmented reality playground as Kinect Party presents 36 channels - each overflowing with outrageously unique, motion-controlled fun. Wield nun chucks, grow fairy wings, dodge hot lava, harness electricity, dig for treasure, launch fireworks, become a fire breathing dragon and more.",81,6.9,Party
20,213564,https://www.metacritic.com/game/wii-u/family-party-30-great-games-obstacle-arcade,https://static.metacritic.com/images/products/games/4/8a730cd39427ddca22c9c1b210f18158-98.jpg,Family Party: 30 Great Games Obstacle Arcade,Wii U,"December 4, 2012",Family Party: 30 Great Games Obstacle Arcade brings home wacky and wild competitions for kids of all ages.,11,2.8,Party
21,182420,https://www.metacritic.com/game/wii-u/rabbids-land,https://static.metacritic.com/images/products/games/0/7bb33ff83ded99b74d562b73588b07a5-98.jpg,Rabbids Land,Wii U,"November 18, 2012","Rabbids have a lot on their plate: princess castle, the pirate boat, haunted house, tunnel of love, roller coaster…there are over 20 + attractions waiting to be invaded!",52,5.7,Party
22,221108,https://www.metacritic.com/game/wii-u/game-party-champions,https://static.metacritic.com/images/products/games/8/b5770ab07f75caa951413935221ec5d7-98.jpg,Game Party Champions,Wii U,"November 18, 2012","Game Party Champions is the fifth and latest installment of the Game Party franchise and available exclusively for Wii U. The game’s pick-up and play style promises to appeal to experienced and new gamers alike. Using the system’s innovative new GamePad, players tilt, turn and touch the controller to play arcade, sports and party games in entirely new ways.",24,3.6,Party
23,213239,https://www.metacritic.com/game/wii-u/nintendo-land,https://static.metacritic.com/images/products/games/9/3084152de7db7b4c4d6051293536bb5c-98.jpg,Nintendo Land,Wii U,"November 18, 2012","Nintendo Land is a theme park featuring 12 different attractions, each with its own play on a Nintendo franchise. Each attraction features it's own special gameplay experiences made possible by the Wii U controller. Depending on the particular attraction, players can compete individually or against other players, or even team up to play cooperatively. Up to 5 players can participate in dynamic multiplayer modes in select attractions. The experiences change each time, depending on whether players are using the GamePad, holding a Wii Remote or just watching others play on the TV screen.",77,7.9,Party
24,217331,https://www.metacritic.com/game/xbox-360/disneypixar-toy-story-mania!,https://static.metacritic.com/images/products/games/1/cbb6d4d8399a1867ee600de740ff5752-98.jpg,Disney/Pixar Toy Story Mania!,Xbox 360,"October 30, 2012","Toy Story Mania!, a bi-coastal star attraction at the Disneyland Resort and Walt Disney World Resort theme parks, is now available for the Wii system. The newest title from Disney Interactive Studios brings classic Disney Pixar Toy Story characters together as they stage their own fun-filled carnival, featuring familiar and one-of-a-kind midway-inspired games, alongside bonus unlockable levels in 3-D.",33,5.0,Party
25,190214,https://www.metacritic.com/game/playstation-vita/super-monkey-ball-banana-splitz,https://static.metacritic.com/images/products/games/4/98b91793b71baf018c6787bfccef7cc4-98.jpg,Super Monkey Ball: Banana Splitz,PlayStation Vita,"October 23, 2012","The puzzling primates return with all-new worlds, original mini-games and updated graphics adding a fresh new vibrancy to Super Monkey Ball for PlayStation Vita. Players can manage each monkey's momentum to navigate narrow ledges, moving platforms and loads of challenging obstacles. Roll your chosen ape to the goal by taking full advantage of the capabilities offered by the innovative new PSVITA handheld console and challenge up to four friends in Wi-Fi enabled multiplayer modes. Fans can also enjoy revamped classic games such as the much-loved Monkey Target, along with brand new additions.",66,7.3,Party
26,188561,https://www.metacritic.com/game/playstation-3/lights-camera-party!,https://static.metacritic.com/images/products/games/1/a125e2a58b40944c98afdc60317d0aa2-98.jpg,"Lights, Camera, Party!",PlayStation 3,"August 28, 2012","Lights, Camera, Party! is a downloadable party game for PS3 Move.",49,4.4,Party
27,182424,https://www.metacritic.com/game/wii/mario-party-9,https://static.metacritic.com/images/products/games/4/c48ed07a342bdad858aafaaace84ea97-98.jpg,Mario Party 9,Wii,"March 11, 2012","The party is back and bigger than ever in the Mario Party 9 game for Wii, featuring all-new ways to play! For the first time in the franchise, boss battles crash the party and challenge players to compete to defeat a common enemy. In addition, players now travel across stages together in a vehicle towards a common goal - overcoming obstacles, battling bosses, and collecting Mini Stars stolen by Bowser™ and his minions. Featuring 80 new minigames, adventurous new stages, and all-new ways to play that blend cooperative and competitive action for up to four players*, Mario Party 9 is the perfect way to get the party started.",73,6.7,Party
28,188189,https://www.metacritic.com/game/playstation-3/start-the-party!-save-the-world,https://static.metacritic.com/images/products/games/9/9fc1dfe798ef5e4d24938ae1d39ed446-98.jpg,Start the Party! Save the World,PlayStation 3,"March 6, 2012","Your PlayStationMove motion controller is about to turn into some of the craziest gadgets imaginable in Start the Party! Save the World on the PlayStation3 system. From the depths of the ocean to skyscraper rooftops, Dr. Terrible is wreaking havoc - pick up your motion controller and battle with this devious enemy. 

- Grab your PlayStationMove motion controller and prepare to battle Dr. Terrible in a series of hilarious mini-games. 
- See yourself on-screen as you use your motion controller to scoop up fish, swat flies and rescue lost divers. 
- Challenge up to three friends on PS3, take down an evil villain and save the world in four different game modes.",50,5.3,Party
29,197524,https://www.metacritic.com/game/xbox-360/apples-to-apples,https://static.metacritic.com/images/products/games/4/79acf3f886388221bd345368b27c41bb-98.jpg,Apples to Apples,Xbox 360,"December 7, 2011","Party-style fun is ripe for the picking as Apples to Apples the video game comes to Xbox LIVE Arcade! This game of hilarious comparisons is as simple as comparing apples to apples - just select the red card you think is most like the green card played by the judge. If the judge picks your card, you win the round. And everyone gets a chance to be the judge! Play online with up to 5 friends in Classic Mode or two variant modes - Baked Apples and Crab Apples! Choose from 26 hilarious Apple Avatars, enjoy environments like Space Apples and Carnival Apples, and collect Golden Apple Cards that mix up the game! Bursting with over 1000 red and green cards, Apples to Apples the video game provides endless hours of unpredictable, over-the-top fun!",64,tbd,Party
30,182054,https://www.metacritic.com/game/playstation-3/pictionary-ultimate-edition,https://static.metacritic.com/images/products/games/4/0d7c16f9e1f98b343a75705cc05cb2d5-98.jpg,Pictionary: Ultimate Edition,PlayStation 3,"November 15, 2011","Pictionary, the game of quick sketches and crazy guesses, has innovative new functionality and game modes for the whole family! In addition to great classic Pictionary play, new features include rotating canvases, one-line challenges and other fun gameplay modes in a lively game show setting.",62,tbd,Party
31,182055,https://www.metacritic.com/game/xbox-360/pictionary-ultimate-edition,https://static.metacritic.com/images/products/games/5/b67aa3481b1b0e580ad77592f791f227-98.jpg,Pictionary: Ultimate Edition,Xbox 360,"November 15, 2011","Pictionary, the game of quick sketches and crazy guesses, has innovative new functionality and game modes for the whole family! In addition to great classic Pictionary play, new features include rotating canvases, one-line challenges and other fun gameplay modes in a lively game show setting.",53,tbd,Party
32,182334,https://www.metacritic.com/game/playstation-3/carnival-island,https://static.metacritic.com/images/products/games/4/d13a4936cb837cae80e231fa8d164e9b-98.jpg,Carnival Island,PlayStation 3,"November 15, 2011","Sony Computer Entertainment America LLC (SCEA) teams up with Magic Pixel Games to bring the fun and excitement of carnivals right into your own living room with Carnival Island.  Carnival Island invites you to take a trip to a magic carnival and experience the joy of classic family-friendly fun in over 35 carnival attractions.  Utilizing the PlayStation®Move controller’s precise tracking technology, every toss, roll, throw, spin and slam is translated directly into the game for accurate and responsive gameplay. 

Explore Carnival Island alone or with friends, while playing games such as minibowl, ring toss, throwdown, and frogbog to earn tickets redeemable for prizes and collectibles.  By completing challenges, players can create their own cheering squad consisting of lovable pets throughout their experience.  Players can also have fun by interacting with fun house mirrors, photo cut-outs and upload snapshots of their experiences directly onto Facebook or send to a PlayStation®Network (PSN) friend.",66,5.2,Party
33,182384,https://www.metacritic.com/game/xbox-360/yoostar-on-mtv,https://static.metacritic.com/images/products/games/4/27f0eeb38077eeb64d91ad36cd757bda-98.jpg,Yoostar on MTV,Xbox 360,"November 15, 2011","Yoostar on MTV offers players fun and excitement as they are transported directly into MTV shows, programming and events.",49,tbd,Party
34,182320,https://www.metacritic.com/game/xbox-360/raving-rabbids-alive-kicking,https://static.metacritic.com/images/products/games/0/2bd6b6edf0d145e102bd70cf3e1c82bb-98.jpg,Raving Rabbids: Alive & Kicking,Xbox 360,"November 8, 2011",Raving Rabbids Alive & Kicking is a game that utilizes the Kinect for the Xbox 360.,58,5.6,Party
35,182382,https://www.metacritic.com/game/3ds/pac-man-party-3d,https://static.metacritic.com/images/products/games/2/c4cee20e9bd266ef0eb48d2074f24a65-98.jpg,Pac-Man Party 3D,3DS,"November 8, 2011","PAC-MAN PARTY 3D brings together family and friends with a fun experience that includes dozens of mini-games for gamers to play with or against each other. Perfect for the whole family, PAC-MAN PARTY 3D features a variety of control styles that utilize the system’s buttons, touchscreen, microphone, and accelerometer.  With support for download play, friends can join in on the fun using just one cartridge shared across Nintendo 3DS systems.",43,4.7,Party
36,182372,https://www.metacritic.com/game/wii/go-vacation,https://static.metacritic.com/images/products/games/2/27612c7d98819c11cd100487b3b912ea-98.jpg,Go Vacation,Wii,"October 11, 2011","From snowcapped mountains to the bright lights of a bustling cityscape, Go Vacation gives gamers the option to take part in heated street races, relaxing scuba diving excursions and pulse-pounding skydiving sessions and more—all accessed by actually visiting each location in-game instead of simply choosing them from a menu.  With support for a whole suite of Wii hardware accessories, including the Wii Balance Board™, the Wii Zapper™ and Wii MotionPlus™, every activity offers a fun and natural control scheme that allows gamers to easily jump in and play.",64,8.3,Party
37,182715,https://www.metacritic.com/game/xbox-360/hole-in-the-wall,https://static.metacritic.com/images/products/games/5/7be7b222053ecb9dd9192b82d1e0e545-98.jpg,Hole in the Wall,Xbox 360,"August 24, 2011","Whether you play solo or with friends, ""Hole in the Wall"" challenges  you to become a human puzzle piece as you contort to fit through wacky shapes that are cut out into themed walls hurtling towards you. Try to pass your body through the wall to boost your score, or you’ll be pushed straight into the water below! Play through different “show” levels in single or multi player modes (up to 4 competitors), or see if you can handle the challenge of “survival” mode as you attack wall after wall until you drop! Unlock special customization elements for your avatar like a silver spandex suit, helmets, t-shirt and other zany gear as a reward for progress in the game.",47,3.4,Party
38,158063,https://www.metacritic.com/game/playstation-3/playstation-move-ape-escape,https://static.metacritic.com/images/products/games/3/338fe204d6a00ce11afcfc677dbad5cc-98.jpg,PlayStation Move Ape Escape,PlayStation 3,"July 5, 2011","You will travel through time in search for Specter to help your new partners, Tohko and Tsukushi.  Pipo monkeys will come and try to steal their favorite bananas from you.  Chase around and capture more than 700 monkeys, the largest number of franchise!  Get yourself ready with the Move controller and capture the pipo monkeys!!",43,4.2,Party
39,175246,https://www.metacritic.com/game/xbox-360/wipeout-in-the-zone,https://static.metacritic.com/images/products/games/6/511976ad42749a401f77d8b75ee14aac-98.jpg,Wipeout: In the Zone,Xbox 360,"June 14, 2011","Based on the ABC hit show Wipeout, Wipeout In the Zone will be the latest release in this hit video game franchise and will have players running, ducking, dodging and wiping out using Kinect for Xbox 360’s full-motion capabilities right in their own living room.",39,5.8,Party
