,id,url,image,title,platform,release_date,summary,metascore,userscore,genre
0,161823,https://www.metacritic.com/game/xbox/dai-senryaku-vii-modern-military-tactics,https://static.metacritic.com/images/products/games/3/b428d21a4a2ee87f6a34d2b05bcd0306-98.jpg,Dai Senryaku VII: Modern Military Tactics,Xbox,"February 16, 2005","Command an entire military force with the most modern technologies of war. In this strategic war simulation, you must take into account everything from terrain to armor. Test your battlefield tactics against the game's challenging artificial intelligence, or face your friends in multiplayer skirmishes. Choose from a wide array of vehicles specifically designed for land, sea, and air attacks. If you don't like the terrain, you can create your own with the map editor, and you can design the map to cater to your specific strategic strengths.",74,7.9,Turn-Based
1,103268,https://www.metacritic.com/game/pc/flashpoint-germany,https://static.metacritic.com/images/products/games/8/6f1d962badb61a321d3467da6a5fbcf6-98.jpg,Flashpoint Germany,PC,"January 25, 2005","Flashpoint Germany brings you back to the height of the Cold War, before the collapse of the Soviet Union. Massive armies of incredible power face off across the West German border. A single decision, a mere moment separated a tense peace from the most intense and possibly the last war that the world would ever behold. The stakes could not possibly be higher. You may think you know how this ends, but in Flashpoint Germany, it turned out differently. Step into the maelstrom, choose your side and see what you would have done, if you were there. Flashpoint Germany portrays the highest intensity and density potential combat in human history â€“ the Central Front of a NATO vs. Warsaw Pact World War III. As the General in charge of a regiment or brigade, you give the orders and let the staff sweat the details. Electronic warfare, tactical doctrine, nuclear and chemical weapons, air strikes, artillery, smoke and minefields are all represented, along with a complete database of accurate equipment and unit types. [Matrix Games]",76,tbd,Turn-Based
2,104258,https://www.metacritic.com/game/pc/gates-of-troy,https://static.metacritic.com/images/products/games/8/f7c51ead5c8d1f478220e860989b3da1-98.jpg,Gates of Troy,PC,"December 8, 2004","Gates of Troy is a Trojan themed expansion pack for ""Spartan,"" the award winning turn-based strategy game from Slitherine Software. It includes 17 new heroes ranging from Achilles and Hektor in the Trojan Wars to Leonidas & Demophilus in the pass of Thermopylae. Play as Achilles with his Myrmidon warriors, or maybe you prefer Odysseus or Hektor? Control vast armies of Trojans and Greeks and lay siege to the most powerful city of its time ? Troy! Take command of Leonidas and his 300 Spartans against the mighty Persian horde. The pass of Thermopylae has been re-created on a one for one scale with 300 Spartans, 700 Thespian allies under Demophilus & 400 unreliable Thebans who really didn't want to be there ? and can you blame them! This small force stands against the might of the Persian army with wave upon wave of increasingly powerful troops hitting your lines until the mighty Immortals arrive. Xerxes launches attack after attack from his inexhaustible horde and your objective is just to hold the pass long enough for Greece to muster her forces. [Slitherine]",70,8.4,Turn-Based
3,104015,https://www.metacritic.com/game/pc/worms-forts-under-siege,https://static.metacritic.com/images/products/games/5/47e7a1b2a49e1a46d5dbfe35503fd753-98.jpg,Worms Forts: Under Siege,PC,"November 24, 2004","Worms Forts: Under Siege! puts players in command of a crack team of up to four fort-dwelling worms. Set in the cartoon environments that will be very familiar to Worms fans, players direct their worm garrison to construct defenses to maximize strategic advantages, expand castles, seize valuable victory locations and of course, build massively destructive weapons to eliminate their opponents' fortifications. Players can test their mettle in a single-player game by battling through the 20 missions, or they can take on up to four friends in the frenzy of destruction that is Fort vs. Fort mode. Massive weapons and massive destruction, including catapults, cannons, giant crossbows, bows and arrows, rocket launchers, air strikes, napalm... even nuclear strikes; For the first time in the history of the series, players can build their own castle, including towers, walls, citadels and keeps. Each building will offer unique special powers and weapons, and poor choices may leave players lagging in the arms race. [Acclaim]",60,7.4,Turn-Based
4,103775,https://www.metacritic.com/game/pc/galactic-civilizations-altarian-prophecy,https://static.metacritic.com/images/products/games/5/2a1b89e3cdd423d2e79a5e1867f79d43-98.jpg,Galactic Civilizations: Altarian Prophecy,PC,"November 12, 2004","Galactic Civilizations: Altarian Prophecy is an expansion pack to Stardock's award winning space strategy game, Galactic Civilizations. The expansion pack adds a host of new features, content, and other enhancements to the game to add depth and much greater replayability. In the late 22nd century, humanity came into contact with 5 major alien civilizations. These civilizations were called, the Drengin Empire, the Torian Confederation, the Arcean Empire, the Yor Collective and the Altarian Republic. Of these 5, the Altarians were the most curious to us. Not for their cultural traits or their technology but because they happened to look human. How was this possible? The ""Altarian Prophecy"" is a campaign that takes the player on a multi-game journey to solve the mystery alluded to in Galactic Civilizations. In doing so, it introduces two new civilizations: The Dominion of the Korx and the Drath. These two civilizations hold the secret to Altaria's past, but worse, they know the Altarian Prophecy that for tells the destruction of the galaxy that is connected to Altaria's past. [Strategy First]",77,6.9,Turn-Based
5,162467,https://www.metacritic.com/game/game-boy-advance/the-lord-of-the-rings-the-third-age,https://static.metacritic.com/images/products/games/7/c11f6144232e0a6f8c00a36ca2e51f17-98.jpg,"The Lord of the Rings, The Third Age",Game Boy Advance,"November 2, 2004","In The Lord of the Rings: The Third Age, you can travel in the wake of the Fellowship while exploring your own path and periodically intersecting the major events of the film trilogy. Through both familiar and new locations, you must fight to save or destroy Middle-earth in an epic adventure. Encounter the demonic Balrog in the Mines of Moria, defend the fallen city of Osgiliath, or try to destroy Helm's Deep. These choices and many more will confront you as you align yourself with the people of Middle-earth or undertake missions on behalf of Sauron.",67,8.3,Turn-Based
6,104317,https://www.metacritic.com/game/pc/tin-soldiers-alexander-the-great,https://static.metacritic.com/images/products/games/7/043604d7f7d20c2b7dc67f098bfa302f-98.jpg,Tin Soldiers: Alexander the Great,PC,"October 8, 2004","Tin Soldiers: Alexander the Great is wargaming with a classic style. Easy to learn but difficult to master, it places you in the role of Alexander the Great during his conquest of the known world. Guide Alexander through his grand campaign from inheriting his father?s legacy at the battle of Thebes to his conquest of Darius III and the Persian Empire through his last great battle at the Hydaspes, in the heart of Asia against the Indian army of King Porus. Designed to evoke the beauty of museum-quality miniatures on a professional tabletop battlefield, Tin Soldiers: Alexander the Great uses an innovative multi-phase turn-based system. As you play, the campaign unfolds before you with cinematic cut-scenes and three dimensional panoramas of the battlefields. Each battle is based on the historical terrain and troop placements, but the campaign allows you to make decisions in between battles on which units to reinforce, whether to recruit new units or replace commanders and how many of your resources to focus on training. [Koios Works]",77,tbd,Turn-Based
7,103473,https://www.metacritic.com/game/playstation-2/phantom-brave,https://static.metacritic.com/images/products/games/3/658a536c1982c99ef26dbd0908311b51-98.jpg,Phantom Brave,PlayStation 2,"August 31, 2004","Phantom Brave is the spiritual successor to 2003's strategy role-playing game ""Disgaea: Hour of Darkness.""  Enter thirteen-year-old orphan Marona who lives alone on Phantom Isle Island. Marona isn't your average child, as she has the uncanny ability to see and manipulate spirits, one of whom happens to be Ash, a swordsman who died alongside Marona's mother and father. Ash serves as a companion and guardian to Marona, counseling her as she works to help people in the surrounding islands who rely on her abilities. Key Phantom Brave features include: No more grids!  Free-roaming battle system allows you to strategically place your characters anywhere you want on the battle field; Create and customize the jobs of your soldiers with over 400 different skills and magical spells; Step-by-step tutorials will have even the novice player up and running in no time; Experience 20 heart-warming episodes spread over 100 hours of game play; Dual language option! Select either the original Japanese voices or the all new English dub. [Atlus Software]",81,8.2,Turn-Based
8,103436,https://www.metacritic.com/game/playstation-2/front-mission-4,https://static.metacritic.com/images/products/games/6/d2d46ecf0ec6bd241717738bdb67f307-98.jpg,Front Mission 4,PlayStation 2,"June 15, 2004","Front Mission 4 (FM4) marks the debut of the popular mech-based strategy game series on the PS2. Utilizing the technological capabilities of the system, FM4 brings you the newest chapter in the best-selling series. While boasting an enhanced battle system, outstanding new graphics and dramatic voiceovers, FM4 maintains the strategic gameplay that has won acclaim from both gamers and press worldwide. As in the previous games, players can fully customize their wanzers, or mech units, with a variety of powerful weaponry and parts. In addition, new tactical features such as the ""Link System"" bring a new dimension of strategy to the game. Set in 2096, FM4 opens as an unidentified group of wanzers assaults and destroys an E.C. German base. The player?s point of view switches between two main characters that find themselves trapped within a dangerous global conspiracy. Elsa, a new recruit in the E.C.'s Durandal corps, is sent to Germany with her team to investigate the attack. The story then shifts to Darril, a U.C.S. Army sergeant in South America. He and his company are sent to Venezuela after its governor declares independence from the U.C.S. Though Darril's squad seems far more interested in slacking off than fighting a war, their plans for early retirement are put on hold after they witness a fateful plane crash in the jungle. [Square Enix]",75,8.5,Turn-Based
9,162287,https://www.metacritic.com/game/game-boy-advance/shining-force-resurrection-of-the-dark-dragon,https://static.metacritic.com/images/products/games/7/adbea51fc0e3b8b6007dc0c963ab2e2c-98.jpg,Shining Force: Resurrection of the Dark Dragon,Game Boy Advance,"June 8, 2004","Darksol, a mysterious traveler, plans to resurrect a dangerous creature, the Dark Dragon, to invade the kingdom of Guardiana. In Shining Force: Dark Resurrection, you play the part of a young warrior who was washed ashore in Guardiana, and you remember nothing from your past. Now, you must become a leader and control a band of up to 12 characters on the battlefield as you fight to save Guardiana from the forces of evil. On your journey, you'll discover a wide array of weapons, armor, and powerful magic spells.",77,8.6,Turn-Based
10,103363,https://www.metacritic.com/game/pc/spartan-2004,https://static.metacritic.com/images/products/games/3/94f673121429e30d5dffe8518b726228-98.jpg,Spartan (2004),PC,"May 28, 2004","Spartan is the third in a series of turn-based  empire-building strategy games that includes the best-selling Legion and Chariots of War.   Spartan focuses on one of the most influential civilisations in the history of mankind ? the ancient Greeks, and allows players to choose from 100 nations to lead to victory, including Sparta, renowned for its total dedication to the art of war and that produced the ultimate fighting machine of the ancient world ? the Spartan Hoplite; probably most famous for the courageous last stand of 300 Spartans at the Battle of Thermopylae in 480BC. [Just Play]",56,7.9,Turn-Based
11,162363,https://www.metacritic.com/game/gamecube/future-tactics-the-uprising,https://static.metacritic.com/images/products/games/3/910b90b45f8e864bd3c074b57a1712ca-98.jpg,Future Tactics: The Uprising,GameCube,"May 10, 2004","Welcome to the future--a place where creatures have forced humans to live in squalor, battling their overlords and waxing nostalgic for better days. Now, a young boy named Low, his sister, and a collection of fighters find themselves as mankind's only hope for blasting the creatures back to where they came from. You must guide this ragtag team of survivors through 19 levels of tactical combat while upgrading them with powerful weapons. In Battle mode, you can take on a friend in tactical warfare--complete with customizable handicaps, power-ups, and victory conditions.",63,tbd,Turn-Based
12,103569,https://www.metacritic.com/game/playstation-2/future-tactics-the-uprising,https://static.metacritic.com/images/products/games/9/48a93df2054b182b14ba00077b8e9501-98.jpg,Future Tactics: The Uprising,PlayStation 2,"May 10, 2004","Packed with action, Future Tactics is a turn-based tactical RPG that looks and feels like an action/platform game. Built around a highly complex turn-based battle engine, the adventure showcases a single-player Story Mode, as well as a two-player Battle Mode.  The plot is set in the not too distant future, when Earth as we know it has succumbed to a race of extra-dimensional creatures. Now the final hope for restoring order to the planet rests on the shoulders of a young boy, his sister and a rag-tag assembly of unlikely warriors. Future Tactics: The Uprising features: 18 stylized and high-polygon characters interacting in rich, full 3D environments; Unique, number-free turn-based tactical combat system designed to keep players immersed in the action, not the stats; 19 action-packed, highly intense levels waiting to be conquered; Massively deformable terrain. Landscape can be permanently destroyed, leaving behind craters and canyons; Compelling storyline told through fully animated and voiced cut scenes; Two-player customizable battle mode lets gamers tweak handicaps, power-ups and victory conditions; Experience point system allows custom building of team members, allocating upgrades as players see fit; Boot Camp tutorial mode allows novice players to learn good tactics right away. [Crave Entertainment]",61,6.1,Turn-Based
13,163254,https://www.metacritic.com/game/xbox/future-tactics-the-uprising,https://static.metacritic.com/images/products/games/4/f6ba56d946d3da62ee0f230cc7c8301a-98.jpg,Future Tactics: The Uprising,Xbox,"May 10, 2004","Welcome to the future--a place where creatures have forced humans to live in squalor, battling their overlords and waxing nostalgic for better days. Now, a young boy named Low, his sister, and a collection of fighters find themselves as mankind's only hope for blasting the creatures back to where they came from. You must guide this ragtag team of survivors through 19 levels of tactical combat while upgrading them with powerful weapons. In Battle mode, you can take on a friend in tactical warfare--complete with customizable handicaps, power-ups, and victory conditions.",61,tbd,Turn-Based
14,102597,https://www.metacritic.com/game/playstation-2/la-pucelle-tactics,https://static.metacritic.com/images/products/games/7/5fd25b13d859ac7b073e2d262e1d52d1-98.jpg,La Pucelle: Tactics,PlayStation 2,"May 4, 2004","La Pucelle: Tactics is the tactical RPG from Nippon Ichi, creators of ""Disgaea."" La Pucelle: Tactics is a tale of betrayal and double cross, monsters in human form and humans in monster form, set in an alternate medieval Europe. The unlikely hero is a smart mouthed and undisciplined sixteen year old who just passed her exorcism exams and her comrades in La Pucelle, a demon hunting squad. Features Dark Portals and Purification: Brand new to the RPG world, use your powers to purify defiled ground and enemies. If pulled off right the effect is like having a super-giant combo. Damage multiple enemies at once, stop new enemies from appearing, strengthen items in real time. Fast leveling system: Items, characters and skills can increase every round of battle for well earned instant gratification. Carry up to 149 items and use them to learn special magic. Turn enemies to allies. Bring up to 8 units into battle. Seize the high ground! Battlefield terrain will vary in height: attacking down is way better than being attacked from above. [Mastiff]",79,8.7,Turn-Based
15,103748,https://www.metacritic.com/game/pc/massive-assault-network,https://static.metacritic.com/images/products/games/8/162616e565e612450b31a3ac466c7e19-98.jpg,Massive Assault Network,PC,"April 13, 2004","Massive Assault Network is a hardcore online strategy game, based on the original Secret Allies political concept. You will be fighting for global domination on one of 8 distant planets against live opponents via Internet. The game is set in fascinating 3D sci-fi environment. Revolutionary Dynamic Turn-Based Gameplay. Time-proven ""Secret Allies"" concept provides instant intrigue & endless replayability. Ladder, Tournaments & Clan Wars. Take part in individual and team-based competitions. Live Mentors & Friendly Online Community
Train with dedicated live Mentors. Use Built-in Chat to find opponents & get help from other players. Fascinating 3D Engine. State-of-the-art unit and terrain graphics revolutionary for TBS genre. Free Training with A.I. 8 Training Missions, 3 Scenarios and one planet for World Wars. Unlimited Trial Period. Play any number of World War games vs live players on beautiful ""Emerald"" planet. [Wargaming.net]",74,4.6,Turn-Based
16,102472,https://www.metacritic.com/game/pc/worms-3d,https://static.metacritic.com/images/products/games/2/f365d9bcc32ef987e2285efd17225f54-98.jpg,Worms 3D,PC,"March 11, 2004","Worms comes to PC and console in full 3-D, continuing to capture the true essence of the game as teams of worms battle across bizarre, randomly generated landscapes, or across finely crafted, custom-designed levels utilising an arsenal of devastating weapons. The gameplay remains unchanged, featuring turn-based fighting and relying on the player to judge the trajectory and strength of their shots in order to inflict maximum damage on opponents. All the favourite weapons such as bazooka, grenade, dynamite, air strike and sheep are present including some new additions. Defensive tactics can also be employed as you choose to dig in with buildings, trenches, sandbags or fortifications, while buildings on the landscapes can also provide shelter against attacks. Adapt your strategy according to the weapons available, landscape and each new opponent you play. With a multitude of tactics available, coupled with the ever-changing, randomly generated landscapes, no battle will ever be the same. Worms 3D is set in a more exciting and immersive game world than ever before, with the emphasis on great multi-player action and challenging single-player fun.",74,7.1,Turn-Based
17,103518,https://www.metacritic.com/game/playstation-2/romance-of-the-three-kingdoms-ix,https://static.metacritic.com/images/products/games/8/11921f975bd7c322e6bbc7ebd3fbedb5-98.jpg,Romance of the Three Kingdoms IX,PlayStation 2,"February 24, 2004","With Ancient China as the backdrop, the game chronicles the dramatic events of the 2nd and 3rd centuries when the once grand empire fell into civil war. While retaining many of the features that have become hallmarks of the Romance series, RTK IX (Romance of the Three Kingdoms IX) is vastly different from previous games in the series. Most notable is that players immediately take the rank of a Ruler. Traditionally reserved as the highest rank in the series, the role of Ruler will test any player?s leadership, management and strategy skills. As a Ruler, one of the keys to maintaining authority is a strong corps of loyal officers, so RTK IX?s Officer Development System has been enhanced with a new point and item system. With the new point system, players earn points to increase officer abilities and skills. With the item system, certain items can further an officer?s development, heighten intelligence or improve his abilities in war. Players can now use save data from Dynasty Warriors 4, Dynasty Warriors 4 Xtreme Legends or Dynasty Tactics 2 to obtain a new officer. [KOEI]",74,8.3,Turn-Based
18,162104,https://www.metacritic.com/game/xbox/wrath-unleashed,https://static.metacritic.com/images/products/games/4/1d4e275fabd5cc8700769ec4f0d9e725-98.jpg,Wrath Unleashed,Xbox,"February 10, 2004","Join an epic contest between darkness and light. Wrath Unleashed puts you in a fantastic, deadly world of mythological creatures and giant floating arenas.  Take part in intense fighting action, thought-provoking strategy and vicious head-to-head mayhem.  Wrath Unleashed features nine different terrain types, 15 multiplayer maps and over a dozen single player maps.  This unique action-strategy game pits up to four players and an array of all-powerful fantasy creatures against each other.  And you'll need to unleash every bit of your wrath upon the world to win.",69,7.0,Turn-Based
19,103124,https://www.metacritic.com/game/playstation-2/wrath-unleashed,https://static.metacritic.com/images/products/games/4/34737366ef3d7bee404de8deca600301-98.jpg,Wrath Unleashed,PlayStation 2,"February 10, 2004","Mythological creatures from the dawn of time. Epic contests between darkness and light. Battles for domination of giant floating arenas. Welcome to the fantastic, deadly world of Wrath Unleashed. Part intense fighting-action. Part thought-provoking strategy. Pure vicious head-to-head mayhem. This unique action-strategy game pits up to four players and an array of all-powerful fantasy creatures against each other. And you'll need to unleash every bit of your wrath upon the world to win. [LucasArts]",64,6.0,Turn-Based
20,102154,https://www.metacritic.com/game/pc/silent-storm,https://static.metacritic.com/images/products/games/4/0c6dd516062606729fbb05f60d3fb2e2-98.jpg,Silent Storm,PC,"January 20, 2004","Silent Storm is a true 3D tactical turn-based Role-Playing-Game set against the backdrop of WWII. 
As the conflict rages on the frontlines, you?ll be leading a small multinational squad behind enemy lines to gather information and wreak havoc on your enemies while trying to thwart a mysterious new rising power whose plans are even more horrific than anything the world has yet witnessed.

Silent Storm is fully rendered in breathtaking 3D ? and includes fully destructible environments, realistic weaponry and unlimited tactical possibilities. Turn-based gaming has never looked this good! Choose your squad from over 40 operatives of 30 different nationalities, each with a unique background and mix of specialties and skills. [Encore/JoWood]",83,8.3,Turn-Based
21,103295,https://www.metacritic.com/game/pc/yu-gi-oh!-power-of-chaos-yugi-the-destiny,https://static.metacritic.com/images/products/games/5/a19e3916148905a3c981288bdb93025d-98.jpg,Yu-Gi-Oh! Power of Chaos: Yugi the Destiny,PC,"January 12, 2004","Learn to play the hit Yu-Gi-Oh! TRADING CARD GAME with Yugi! Featuring stunningly detailed graphics, card artwork and dueling fields, prepare for the most intense Yu-Gi-Oh! duels ever! Power of Chaos is an essential learning tool for beginners who want to learn and understand how to play the Yu-Gi-Oh! TRADING CARD GAME like a master! [Konami]",52,6.0,Turn-Based
22,103447,https://www.metacritic.com/game/pc/disciples-ii-rise-of-the-elves,https://static.metacritic.com/images/products/games/7/9f43e733486a165ece114d7e1c1d61f2-98.jpg,Disciples II: Rise of the Elves,PC,"November 25, 2003","Disciples II: Rise of the Elves is a milestone in the Disciples universe. For the first time, Disciples fans will be able to play as the elder Elven race as they struggle to reclaim their forests from the four primary forces in Nevendaar. Driven by an unpredictable god who urges them to battle, the Elves begin a massive march towards their fate. The noble Elves rule their people from elaborate fortresses within the trees. They adorn themselves with ornate armor and prefer councils or negotiations to conflict. Their queen is a just leader, preferring the path of peace for her kind. The noble Elves owe much to the Empire... The wild Elves have become forest predators. Their intolerance of the civilized world has reached new extremes and they have reduced themselves to highwaymen and bandits. They tolerate the noble bloodline, but do not respect it. The thought of their race allying with another is appalling. As one tiny oracle heralds the unquestionable will of Gallean to lash out against his timeless enemies, the Elves must unite their scattered tribes. [Strategy First]",80,8.2,Turn-Based
