,id,url,image,title,platform,release_date,summary,metascore,userscore,genre
502,498936,https://www.metacritic.com/game/ios/lost-frontier,https://static.metacritic.com/images/products/games/6/ecde2dff63f78dca843eada8d4704a5c-98.jpg,Lost Frontier,iOS,"June 2, 2016","Lost Frontier is a turn-based strategy game, brought to you from the creators of the Battleheart and Zombieville series'. In a fantasy-western setting consumed by steam-punk technology and the supernatural, can you survive with just your wit and a six-gun at your side?",89,7.6,Turn-Based
503,497558,https://www.metacritic.com/game/pc/planar-conquest,https://static.metacritic.com/images/products/games/8/799c2c845db4390ea088a8f486bb04e6-98.jpg,Planar Conquest,PC,"May 30, 2016","Assume the roll of an all-powerful Sorcerer Lord and lead one of 8 different races to the ultimate victory. Explore multiple planes of existence, raid dungeons, and conquer cities. Expand your armies, cast mighty spells, and summon godly creatures to do your bidding. Fight the enemies in D20 OGL battles.",53,6.4,Turn-Based
504,462619,https://www.metacritic.com/game/pc/total-war-warhammer,https://static.metacritic.com/images/products/games/9/bca6c5701d9d7c3291af8bcb90bd6707-98.jpg,Total War: WARHAMMER,PC,"May 24, 2016","In an era of ceaseless conquest, a myriad warriors clash in epic battles as entire races wage war on one another, each led by a notorious hero seeking dominion over the world. All at your command. The courageous Karl Franz marshals the men of the Empire, looking to unite the fractured elector counts under a banner of strength against their common foes. Hungry for the vicious brutality of combat, the Greenskins flock to the tribe of Grimgor Ironhide; Orcs and Goblins alike filled with an insatiable thirst for carnage. High King Thorgrim helms the stoic Dwarfs forth from their mountain strongholds, marching to right the serious injustices wrought upon them over the millennia. Yet the motives of the Vampire Counts under Mannfred von Carstein are shrouded in murderous secrecy, his armies raised from the decrepit ranks of the dead. And while the Old World is torn by betrayal, war and the unleashing of unfathomable power, a rising threat still whispers in the winds from the north. The fabric of reality itself begins to rend and buckle.",86,7.4,Turn-Based
505,497593,https://www.metacritic.com/game/pc/sengoku-jidai-shadow-of-the-shogun,https://static.metacritic.com/images/products/games/3/401a7ca9beb58514311a7bae838bebe4-98.jpg,Sengoku Jidai: Shadow of the Shogun,PC,"May 19, 2016",Sengoku Jidai: Shadow of the Shogun is a turn-based tactical and strategic game set during the Sengoku era; primarily focusing on the Japanese Warring States period and Japanese Invasion of Korea.,85,5.8,Turn-Based
506,495474,https://www.metacritic.com/game/playstation-4/valkyria-chronicles-remastered,https://static.metacritic.com/images/products/games/4/d9d409d1db4937ed01818fdd76cb178e-98.jpg,Valkyria Chronicles Remastered,PlayStation 4,"May 17, 2016","The Principality of Gallia, a small neutral country between two superpower nations, suddenly faces invasion at the hands of the Empire. In the face of an overwhelming military power, the Gallian army has lost all hope. However, a ragtag volunteer militia has risen up against all odds to fight off the invading Imperial Army! Through various situations born of the extreme nature of war, this large-scale strategy RPG depicts themes such as living life to the fullest and the importance of human relationships. [Sega]",84,8.2,Turn-Based
507,471085,https://www.metacritic.com/game/pc/tastee-lethal-tactics,https://static.metacritic.com/images/products/games/5/7461465a6f356129c2c3e1ff5fe7ea29-98.jpg,TASTEE: Lethal Tactics,PC,"May 10, 2016","Strategy has a new name and itâ€™s damn TASTEE. Recruit a team of volatile mercs and execute dramatic gunfights on a mission to take down the Cartel. Out think, outmaneuver, and eliminate enemies in a fresh take on simultaneous turn-based tactics. Precision planning meets epic action.",74,6.3,Turn-Based
508,289993,https://www.metacritic.com/game/pc/duelyst,https://static.metacritic.com/images/products/games/3/31be5f193780a8634902ff49d6fb4663-98.jpg,Duelyst,PC,"May 3, 2016","Duelyst is a tactical turn-based strategy game with a heavy focus on ranked competitive play, brought to you by veteran developers and creators from Diablo III, Rogue Legacy and the Ratchet & Clank series. 

The world of Duelyst has an expansive identity and mythology, with gorgeous landscapes filled with rich, complex characters, untold stories and unraveled histories. The focus is on squad-based combat on a tactical map with fast-paced multiplayer 1v1 battles where victory comes from defeating your opponent's General. At launch, there will be five unique factions with a roster of 100+ battle units and spells.",82,7.7,Turn-Based
509,498167,https://www.metacritic.com/game/ios/pathfinder-adventures,https://static.metacritic.com/images/products/games/7/cadf477a0f4e4cfb0af02b74c5869afc-98.jpg,Pathfinder Adventures,iOS,"April 27, 2016",,85,7.9,Turn-Based
510,498177,https://www.metacritic.com/game/pc/hearthstone-heroes-of-warcraft---whispers-of-the-old-gods,https://static.metacritic.com/images/products/games/7/d52a11e491c136e238a037390952691e-98.jpg,Hearthstone: Heroes of Warcraft - Whispers of the Old Gods,PC,"April 26, 2016","This sinister expansion revolves around the dark influence of the Old Gods, ancient and unspeakably evil creatures that have long lay hidden, imprisoned in the dark places of the world millennia ago. Despite their imprisonment, these shadowy beings' influence can be felt in every corner of Azeroth, twisting and corrupting any who hear their maddening whispers. With an army of followers performing forbidden empowerment rituals, the tentacles of these massive horrors are growing rapidly toward the light, eager to bring their own kind of excitement to the sunlit kingdoms and merry taverns of Azeroth.",85,4.9,Turn-Based
511,494239,https://www.metacritic.com/game/pc/hyperdevotion-noire-goddess-black-heart,https://static.metacritic.com/images/products/games/9/a964a716b39cc3667fb7555c7ed40a77-98.jpg,Hyperdevotion Noire: Goddess Black Heart,PC,"April 26, 2016","Gamarket - Similar, but separate from the world known as Gamindustri...

Neptune, also known as Purple Heart, guards the nation of Planeptune.
Blanc, also known as White Heart, guards the nation of Lowee.
Vert, also known as Green Heart, guards the nation of Leanbox.
Noire, also known as Black Heart, guards the nation of Lastation.

In order to unite the nations of this world, the four CPUs (Console Patron Units) compete with one another and fight for supremacy. Right before Noire attains her ambition for a united Gamarket under Lastations rule, someone cuts off the source of the four CPUs powers  their Shares.

To save their world, which has been thrust into a state of chaos, the CPUs decide to join forces in order to bring Gamarket together under one single, unified banner.",65,4.0,Turn-Based
512,497145,https://www.metacritic.com/game/xbox-one/battle-worlds-kronos,https://static.metacritic.com/images/products/games/5/0c436542c415807846eb18eaf11e1c49-98.jpg,Battle Worlds: Kronos,Xbox One,"April 26, 2016","Battle Worlds: Kronos is a turn-based strategy game that stays true to its hexagonal-roots, inspired by classics like Battle Isle. The planet is once again torn by war, for the succession of a new emperor. Its destiny is in your hands.",65,5.4,Turn-Based
513,497146,https://www.metacritic.com/game/playstation-4/battle-worlds-kronos,https://static.metacritic.com/images/products/games/6/4d45363b5715c128ab7998c328479bc7-98.jpg,Battle Worlds: Kronos,PlayStation 4,"April 26, 2016","Battle Worlds: Kronos is a turn-based strategy game that stays true to its hexagonal-roots, inspired by classics like Battle Isle. The planet is once again torn by war, for the succession of a new emperor. Its destiny is in your hands.",62,5.7,Turn-Based
514,497106,https://www.metacritic.com/game/pc/megamagic-wizards-of-the-neon-age,https://static.metacritic.com/images/products/games/6/14318e2ea33f65682f9ca3ec6c037e2d-98.jpg,Megamagic: Wizards of the Neon Age,PC,"April 20, 2016","Get ready to delve into a fascinating world where the forces of technology and magic are embroiled in a vicious struggle! Blurring the lines between the RPG and strategy genres, Megamagic recaptures the unmistakable flavour of the 80s in a game magnified by the incredible music by Mitch Murder.",67,7.3,Turn-Based
515,493609,https://www.metacritic.com/game/3ds/langrisser-reincarnation--tensei-,https://static.metacritic.com/images/products/games/9/5fe6b945183c8f84734de7d1d9725752-98.jpg,Langrisser Re:Incarnation -TENSEI-,3DS,"April 19, 2016",Langrisser Re:Incarnation -TENSEI- is a strategic simulation RPG experience for the Nintendo 3DS,35,4.2,Turn-Based
516,414426,https://www.metacritic.com/game/pc/the-banner-saga-2,https://static.metacritic.com/images/products/games/6/0aaaa65f9e0f731c0f4f704fca2ed3ac-98.jpg,The Banner Saga 2,PC,"April 19, 2016",The aga continues in The Banner Saga 2. Continue your journey soon after the climactic events of The Banner Saga. The choices you made in the first game will affect who is alive and who is dead in this sequel.,82,8.3,Turn-Based
517,494072,https://www.metacritic.com/game/playstation-4/invisible-inc-console-edition,https://static.metacritic.com/images/products/games/2/afdcd96a743763c46fc782b23cacce4f-98.jpg,"Invisible, Inc. Console Edition",PlayStation 4,"April 19, 2016","Invisible, Inc. is a mercenary espionage agency operating in the latter years of the 21st century. Infiltrate procedurally generated corporate facilities in tense, turn-based missions where every move could be your last. Find profit in chaos as you guide your team around the world in search of lucrative contracts.",82,6.9,Turn-Based
518,381493,https://www.metacritic.com/game/pc/chronicle-runescape-legends,https://static.metacritic.com/images/products/games/3/419d55b40728714858a62e69bf76ab64-98.jpg,Chronicle: RuneScape Legends,PC,"March 23, 2016","Play with the fate of Legends in a battle of wits, strategy and combat, where lives are gambled on the turn of your cards. Leave your minions behind as you fight your own battles, expand and master your deck, and face the challenge of unique card combat. Chronicle is a new kind of card gaming experience.",76,6.8,Turn-Based
519,495457,https://www.metacritic.com/game/pc/polaris-sector,https://static.metacritic.com/images/products/games/7/50d523f2e3467c38ba1af8b5606bbbe3-98.jpg,Polaris Sector,PC,"March 22, 2016","The ancients who named this sector â€˜Polarisâ€™ sure had a unique sense of humor. Polaris - the bright star, the star of hope and faith. Well the Polaris sector has precious little of either; just a wilderness of gas, stars, and supernovas soaked in treachery, oppression, and the lust for power. Can anyone build an empire in a place like this? Other factions are naturally suspicious of newcomers and may wage war at the first sign of unidentified craft. Here, a natural death is an uncommon luxury. You look weak? Pirates and scavengers will plunder your planets. You show military strength to discourage potential enemies? Your rivals will combine their forces to eliminate the threat.",76,7.2,Turn-Based
520,491950,https://www.metacritic.com/game/playstation-vita/xcom-enemy-unknown-plus,https://static.metacritic.com/images/products/games/0/8a01a790cf14ed93f40408f0433d9882-98.jpg,XCOM: Enemy Unknown Plus,PlayStation Vita,"March 22, 2016","Threatened by an unknown enemy, the Earth's governments unite to form a secret paramilitary organization, known as XCOM, to combat this extraterrestrial attack. As the commander of XCOM, you control the global defense team and its resources in a battle against the terrifying alien invasion. XCOM: Enemy Unknown is a reimagining of X-COM, the classic strategy game from 1993, and developed by the award-winning creators of Civilization. You will control the fate of the human race by creating and managing a fully operational base, researching alien technologies, planning combat missions, and controlling soldier movement in battle.",82,8.3,Turn-Based
521,493669,https://www.metacritic.com/game/3ds/fire-emblem-fates-revelation,https://static.metacritic.com/images/products/games/9/37a7e0f1ecc9df3478500bf4ca86f4bb-98.jpg,Fire Emblem Fates: Revelation,3DS,"March 10, 2016",Requires full version of Fire Emblem Fates: Conquest or Fire Emblem Fates: Birthright.,88,7.1,Turn-Based
522,494366,https://www.metacritic.com/game/playstation-4/hitman-go-definitive-edition,https://static.metacritic.com/images/products/games/6/c36ed0535ef52a8db61af1bc4db325cf-98.jpg,Hitman GO: Definitive Edition,PlayStation 4,"February 23, 2016","Get your daily fix of Agent 47 with this elegant, strategy-based Hitman game.",77,6.6,Turn-Based
523,494367,https://www.metacritic.com/game/playstation-vita/hitman-go-definitive-edition,https://static.metacritic.com/images/products/games/7/c36ed0535ef52a8db61af1bc4db325cf-98.jpg,Hitman GO: Definitive Edition,PlayStation Vita,"February 23, 2016","Get your daily fix of Agent 47 with this elegant, strategy-based Hitman game!",80,7.2,Turn-Based
524,496082,https://www.metacritic.com/game/pc/hitman-go-definitive-edition,https://static.metacritic.com/images/products/games/2/4ba0011b219f70e3c604c0f1cdb8b465-98.jpg,Hitman GO: Definitive Edition,PC,"February 23, 2016","Get your daily fix of Agent 47 with this elegant, strategy-based Hitman game!",72,5.2,Turn-Based
525,493684,https://www.metacritic.com/game/3ds/fire-emblem-fates-special-edition,https://static.metacritic.com/images/products/games/4/c1f59b12b6a1ad289a2b78b7060c5bc7-98.jpg,Fire Emblem Fates: Special Edition,3DS,"February 19, 2016","Fire Emblem Fates Special Edition Includes: All 3 Versions of Fire Emblem: Fates (Birthright, Conquest, Revelation*) on a Single Cartrige. *Allows purchasers to play Revelations three weeks prior to launch on eshop. It's the only way to get all Three Versions on a Single Cartridge. Also includes a Hardcover Art Book and Nintendo 3DS XL Carrying Pouch featuring Game Art. Two kingdoms are on the brink of war. Whose side will you choose? Torn between two families, youâ€™re an heir of Hoshido, raised by Nohrian royals. If you walk the path of Conquest, you must fight to change your misguided kingdom from within. Command warriors with expert precision and forge deep relationships to master this turn-based strategy game.",88,7.8,Turn-Based
526,428406,https://www.metacritic.com/game/3ds/fire-emblem-fates-conquest,https://static.metacritic.com/images/products/games/6/36f1dd9bf3328ff73b1476ad7c61fc3c-98.jpg,Fire Emblem Fates: Conquest,3DS,"February 19, 2016","Two kingdoms at war â€“ the peace-loving Hoshido and the glory-seeking Nohr. It is up to the player to decide which side to fight for. As the prince/princess of Hoshido, who was raised by Nohr royal family, you will be torn between two families you love. Whichever path you take, you will face different types of challenges.",87,8.0,Turn-Based
527,455142,https://www.metacritic.com/game/3ds/fire-emblem-fates-birthright,https://static.metacritic.com/images/products/games/2/87354ecee85f7cf67facec27e88856c0-98.jpg,Fire Emblem Fates: Birthright,3DS,"February 19, 2016","Two kingdoms at war â€“ the peace-loving Hoshido and the glory-seeking Nohr. It is up to the player to decide which side to fight for. As the prince/princess of Hoshido, who was raised by Nohr royal family, you will be torn between two families you love. Whichever path you take, you will face different types of challenges.",86,7.8,Turn-Based
528,496042,https://www.metacritic.com/game/pc/galactic-civilizations-iii-mercenaries,https://static.metacritic.com/images/products/games/2/73ce80b90c3a65343929c22179bad8a7-98.jpg,Galactic Civilizations III: Mercenaries,PC,"February 18, 2016","The human race is fighting a desperate war against the remorseless Drengin Empire. Both sides have become increasingly desperate, leading them to turn to the galactic underworld and their elite mercenaries. In Mercenaries, the first expansion to Galactic Civilizations III, new opportunities open up across the galaxy in the form of Galactic Bazaars. When you discover one of these hidden establishments, you can choose from a long list of hired guns and pay a mercenary to take care of business for you.",66,5.7,Turn-Based
529,493547,https://www.metacritic.com/game/pc/dungelot-shattered-lands,https://static.metacritic.com/images/products/games/7/5f7009458c0a5a9abb0275089e61bc15-98.jpg,Dungelot: Shattered Lands,PC,"February 18, 2016","Dungelot: Shattered Lands takes you on an epic roguelike dungeon-crawler adventure to defeat zombie cows, splat giant evil mushrooms, and generally get back home in one piece. Deceptively simple, ever so addictive.",78,6.8,Turn-Based
530,491522,https://www.metacritic.com/game/playstation-4/rainbow-moon,https://static.metacritic.com/images/products/games/2/d92a4aacf5699ed8ce5b8924b07c4e31-98.jpg,Rainbow Moon,PlayStation 4,"February 16, 2016","Download Rainbow Moon and embark on an epic adventure through a beautiful open world! 

Rainbow Moon is a beautiful role-playing game filled with exploration, turn-based battles, and character development. Six playable main characters with upgradeable weapons and armor, and more than 20 challenging dungeons await you in a fascinating story that lasts over 40 hours.

 Play for 100 hours and more, including all side quests and optional content.
 Acquire and customize new weapons, armor, and accessories.
 Battle around 100 nasty monsters from 17 different classes.
 Learn over 120 exciting special skills.
 Earn more than 50 trophies, including a prestigious platinum trophy.
 Download additional content and boost your journey.",70,6.5,Turn-Based
531,459210,https://www.metacritic.com/game/3ds/project-x-zone-2,https://static.metacritic.com/images/products/games/0/32009f4d7ea7b90dccc9398c7a36f8d5-98.jpg,Project X Zone 2,3DS,"February 16, 2016","In the sequel to the original world crossing adventure, legendary characters from Japan's most prolific video game publishers come together to create the biggest mashup strategy game ever! Developed by MONOLITH SOFTWARE INC., Project X Zone 2 gives gamers the opportunity to play as their favorite characters from a multitude of franchises and form teams of characters hailing from classic and current franchises and engage enemies through strategic turn-based battles.

Featuring characters from YAKUZA: Dead Souls, the Sakura Wars series and Virtua Fighter series and more from SEGA Interactive Co., Ltd / SEGA Games Co., Ltd, characters from Capcom's franchises including the Resident Evil series, Devil May Cry series and Megaman X series, and characters from the TEKKEN series, Tales of Vesperia, and .hack// series from BANDAI NAMCO!",73,7.5,Turn-Based
532,475977,https://www.metacritic.com/game/pc/xcom-2,https://static.metacritic.com/images/products/games/7/d8e98ec00beecf2724f44a262f4cb25c-98.jpg,XCOM 2,PC,"February 5, 2016","20 years have passed since world leaders unconditionally surrendered to alien forces and XCOM, the world's last line of defense, was left destroyed and scattered. Now the aliens hold dominion over the Earth, building shining cities that promise a brilliant future for humanity on the surface, while hiding a sinister intent below and eliminating all who don't fall in like with their new order. Online those who live a the edges of the world have a modicum of freedom. Here, a force gathers once again to stand up for humanity. Consistently on the run, the remnant XCOM forces need to find a way to regroup, expose the nefarious truth behind the occupation, and eliminate the alien threat for good.",88,7.3,Turn-Based
533,493764,https://www.metacritic.com/game/pc/disgaea-pc,https://static.metacritic.com/images/products/games/4/06cf6970bf2894e3429c0e11688b59c4-98.jpg,Disgaea PC,PC,"February 4, 2016","Laharl, just woken from a two]year long nap and finds out that his father, who was the king, has passed away. In order to regain his rightful title as King of the Netherworld, Laharl sets off on a demonic adventure, but must do so with a back stabbing servant, love stupid angel, and a few disgruntled penguins who are looking for trouble.",74,5.7,Turn-Based
534,495790,https://www.metacritic.com/game/ios/space-grunts,https://static.metacritic.com/images/products/games/0/28edb77a5dd4aea32379aace5ca3ff82-98.jpg,Space Grunts,iOS,"February 3, 2016","Space Grunts combines fast paced arcade action with turn-based gameplay. The year 2476, Earth's space-federation has been building moon-bases across the galaxy. One of those moon-bases has been sending a distress signal. Space Grunts are a group of intergalactic ""problem"" solvers, sent to investigate.. You play one, out of a team, of Space Grunts, and your mission is simple: find your way into the moon-base, and figure out what has happened. You'll have to fight your way through aliens, robots, security drones and base-systems. Find the lower levels of the moon-base, and get to the core of the problems.",81,tbd,Turn-Based
535,495401,https://www.metacritic.com/game/pc/romance-of-the-three-kingdoms-xiii,https://static.metacritic.com/images/products/games/1/ce38415a7290db6362456d8cf6c88998-98.jpg,Romance of the Three Kingdoms XIII,PC,"January 27, 2016","For 30 years, the Romance of the Three Kingdoms series have taken players into the world based on the beloved Chinese novel of the same name; to be a part of one of the most tumultuous times of history and privy to the political machinations between power-hungry factions makes for a perfect strategic experience, especially when each iteration of the game brings about new additions to the grand scheme of unifying 2nd century China. Regardless of their familiarity with the source material, any fan of the strategy genre will appreciate the vast nuances in Koei Tecmo's historical opus; a challenging and rewarding mix of historically accurate warfare and deep gameplay, players will find themselves blissfully taken aback by all the options available in this timeless tale come game. In a macro and micro sense, cites can be built and developed, alliances maintained or betrayed, and armies - that which features a wide variety spanning from infantry, cavalry, artillery, and even navy - can be done via conscription or recruitment. Diplomacy and intrigue also offer a multitude of choices, with historical characters retaining their quirks and personalities, and can be facilitated through bribery, coercion, flattery, and more. With already a huge wealth of content, even if a player sticks to the default Campaign mode, a mode where players follow the events of the novel, with Hero mode, replayability becomes just as inviting as all the aforementioned features. Hero mode allows players to create their own destiny within this pivotal time, and gives them the chance to play out an alternate path of history to their choosing. Of course, like all Romance of the Three Kingdom games that feature many of the characters from the novels, in XIII, there are over 700 historical characters including mainstay fan-favorites like Liu Bei, Cao Cao, Zhao Yun, and more; if you're like us though, you'd create your own unique character and build up your own version of the Middle Kingdom.",61,7.1,Turn-Based
536,246030,https://www.metacritic.com/game/pc/hex-shards-of-fate,https://static.metacritic.com/images/products/games/0/1e2acacb51fe425dfd83fd266aaf00d6-98.jpg,Hex: Shards of Fate,PC,"January 26, 2016",A trading card MMO game.,87,6.3,Turn-Based
537,495400,https://www.metacritic.com/game/ios/dungelot-shattered-lands,https://static.metacritic.com/images/products/games/0/e487a2442bf00696c873bc05f0bda5c0-98.jpg,Dungelot: Shattered Lands,iOS,"January 21, 2016","Dungelot: Shattered Lands takes you on an epic roguelike dungeon-crawler adventure to defeat zombie cows, splat giant evil mushrooms, and generally get back home in one piece. Deceptively simple, ever so addictive.",87,7.0,Turn-Based
538,455127,https://www.metacritic.com/game/wii-u/space-hulk,https://static.metacritic.com/images/products/games/7/240076c4bbd5bd02d1fdc73c5b4b655d-98.jpg,Space Hulk,Wii U,"January 14, 2016","Based on the best-selling board game and set in the Warhammer 40,000 universe, Space Hulk is a 3D digital turn based strategy game that recreates the classic claustrophobic board game experience for single player and multiplayer cross-platform play between PC, Mac and on iOS.

Space Hulk is set in the isolated corridors and tomb-like chambers of an ancient vessel lost in the graveyard of space. Players lead a small army of fearless Space Marine Terminators to battle in a ferocious fight for survival against hordes of predatory alien Genestealers.",53,7.5,Turn-Based
539,398120,https://www.metacritic.com/game/playstation-4/the-banner-saga,https://static.metacritic.com/images/products/games/0/623e7c958183dab0189043c30b1ae9a2-98.jpg,The Banner Saga,PlayStation 4,"January 12, 2016","The Banner Saga is a single player driven Viking saga in which a playerâ€™s choice in travel, conversation and combat determines the outcome of her own personal story as well as the survival of an entire civilization.",79,7.7,Turn-Based
540,414456,https://www.metacritic.com/game/xbox-one/the-banner-saga,https://static.metacritic.com/images/products/games/6/dbe8e7e8a660699964ae352896643fec-98.jpg,The Banner Saga,Xbox One,"January 12, 2016","The Banner Saga is a single player driven Viking saga in which a playerâ€™s choice in travel, conversation and combat determines the outcome of her own personal story as well as the survival of an entire civilization.",76,8.1,Turn-Based
